Notes		Notes on tables
Omon	1	Sea Water Age Since Surface Contact	yr	Time elapsed since water was last in surface layer of the ocean.		agessc	sea_water_age_since_surface_contact	area: mean where sea time: mean		real	longitude latitude olevel time	agessc	ocean	mon	area: areacello volume: volcello	Omon ((isd.003))	Omon_3d	26	baa56de6-e5dd-11e5-8482-ac72891c3257	1bb6dca6b08a4e887ded8a455ef04941	f7e4000e-562c-11e6-a2a4-ac72891c3257	Temporal mean, Global ocean field on model levels [XY-O] [tmean]	-0.001 r	20000.0 s	50.0 s	5000.0 s	AerChemMIP,C4MIP,CFMIP,CMIP,DAMIP,GMMIP,GeoMIP,HighResMIP,LS3MIP,OMIP,VIACSAB	OMIP	All			
Omon	1	Surface Natural Total Alkalinity	mol m-3	total alkalinity equivalent concentration (including carbonate, borate, phosphorus, silicon, and nitrogen components) at preindustrial atmospheric xCO2		talknatos	sea_water_alkalinity_natural_analogue_expressed_as_mole_equivalent	area: mean where sea time: mean		real	longitude latitude time	talknatos	ocnBgchem	mon	area: areacello	Omon ((isd.003))	Omon_oth	26	c918a5be-c5e8-11e6-84e6-5404a60d96b5	c96d62fe-c5f0-11e6-ac20-5404a60d96b5	e9f9f6ca-c1ce-11e6-8067-ac72891c3257	Temporal mean, Global field (single level) [XY-na] [amse-tmn]					AerChemMIP,C4MIP,CMIP,GMMIP,GeoMIP,HighResMIP,LS3MIP,OMIP	OMIP	All			
Omon	1	Ocean Barotropic Mass Streamfunction	kg s-1	Streamfunction or its approximation for free surface models. See OMDP document for details.		msftbarot	ocean_barotropic_mass_streamfunction	area: mean where sea time: mean		real	longitude latitude time	msftbarot	ocean	mon	area: areacello	Omon ((isd.003))	Omon_oth	27	baa57250-e5dd-11e5-8482-ac72891c3257	5edcb9a162e51d0a2c8d42a75bed04ef	e9f9f6ca-c1ce-11e6-8067-ac72891c3257	Temporal mean, Global field (single level) [XY-na] [amse-tmn]					AerChemMIP,C4MIP,CMIP,DAMIP,GMMIP,GeoMIP,HighResMIP,LS3MIP,OMIP,VIACSAB,VolMIP	OMIP	All			
Omon	1	Surface pH	1	negative log10 of hydrogen ion concentration with the concentration expressed as mol H kg-1.		phos	sea_water_ph_reported_on_total_scale	area: mean where sea time: mean		real	longitude latitude time	phos	ocnBgchem	mon	area: areacello	Omon ((isd.003))	Omon_oth	27	c918bbf8-c5e8-11e6-84e6-5404a60d96b5	c96d71ae-c5f0-11e6-ac20-5404a60d96b5	e9f9f6ca-c1ce-11e6-8067-ac72891c3257	Temporal mean, Global field (single level) [XY-na] [amse-tmn]					AerChemMIP,C4MIP,CMIP,GMMIP,GeoMIP,HighResMIP,LS3MIP,OMIP	OMIP	All			
Omon	1	Ocean Mixed Layer Thickness Defined by Sigma T	m	Sigma T is potential density referenced to ocean surface.		mlotst	ocean_mixed_layer_thickness_defined_by_sigma_t	area: mean where sea time: mean		real	longitude latitude time	mlotst	ocean	mon	area: areacello	Omon ((isd.003))	Omon_oth	28	baa57688-e5dd-11e5-8482-ac72891c3257	b1ac17c786f782027deb9a5985ad106e	e9f9f6ca-c1ce-11e6-8067-ac72891c3257	Temporal mean, Global field (single level) [XY-na] [amse-tmn]					AerChemMIP,C4MIP,CMIP,DCPP,GMMIP,GeoMIP,HighResMIP,LS3MIP,OMIP,PAMIP,VIACSAB,VolMIP	CMIP,OMIP	All			
Omon	2	Surface Natural pH	1	negative log10 of hydrogen ion concentration with the concentration expressed as mol H kg-1.		phnatos	sea_water_ph_natural_analogue_reported_on_total_scale	area: mean where sea time: mean		real	longitude latitude time	phnatos	ocnBgchem	mon	area: areacello	Omon ((isd.003))	Omon_oth	28	c918d278-c5e8-11e6-84e6-5404a60d96b5	c96d8090-c5f0-11e6-ac20-5404a60d96b5	e9f9f6ca-c1ce-11e6-8067-ac72891c3257	Temporal mean, Global field (single level) [XY-na] [amse-tmn]					AerChemMIP,C4MIP,CMIP,GMMIP,GeoMIP,HighResMIP,LS3MIP,OMIP	OMIP	All			
Omon	3	Square of Ocean Mixed Layer Thickness Defined by Sigma T	m2	The phrase 'square_of_X' means X*X. The ocean mixed layer is the upper part of the ocean, regarded as being well-mixed. The base of the mixed layer defined by 'temperature', 'sigma', 'sigma_theta', 'sigma_t' or vertical diffusivity is the level at which the quantity indicated differs from its surface value by a certain amount. A coordinate variable or scalar coordinate variable with standard name sea_water_sigma_t_difference can be used to specify the sigma_t criterion that determines the layer thickness. Sigma-t of sea water is the density of water at atmospheric pressure (i.e. the surface) having the same temperature and salinity, minus 1000 kg m-3. 'Thickness' means the vertical extent of a layer.		mlotstsq	square_of_ocean_mixed_layer_thickness_defined_by_sigma_t	area: mean where sea time: mean		real	longitude latitude time	mlotstsq	ocean	mon	area: areacello	Omon ((isd.003))	Omon_oth	29	baa57ac0-e5dd-11e5-8482-ac72891c3257	1c502fa4d453b20feafa63a862eaeb57	e9f9f6ca-c1ce-11e6-8067-ac72891c3257	Temporal mean, Global field (single level) [XY-na] [amse-tmn]					AerChemMIP,C4MIP,CMIP,GMMIP,GeoMIP,HighResMIP,LS3MIP,OMIP,VIACSAB	OMIP	All			
Omon	2	Surface Abiotic pH	1	negative log10 of hydrogen ion concentration with the concentration expressed as mol H kg-1.		phabioos	sea_water_ph_abiotic_analogue_reported_on_total_scale	area: mean where sea time: mean		real	longitude latitude time	phabioos	ocnBgchem	mon	area: areacello	Omon ((isd.003))	Omon_oth	29	c918e696-c5e8-11e6-84e6-5404a60d96b5	c96d8ffe-c5f0-11e6-ac20-5404a60d96b5	e9f9f6ca-c1ce-11e6-8067-ac72891c3257	Temporal mean, Global field (single level) [XY-na] [amse-tmn]					AerChemMIP,C4MIP,CMIP,GMMIP,GeoMIP,HighResMIP,LS3MIP,OMIP	OMIP	All			
Omon	1	Maximum Ocean Mixed Layer Thickness Defined by Sigma T	m	Sigma T is potential density referenced to ocean surface.		mlotstmax	ocean_mixed_layer_thickness_defined_by_sigma_t	area: mean time: maximum		real	longitude latitude time	mlotstmax	ocean	mon	area: areacello	Omon ((isd.003))	Omon_oth	30	1aab3e76-b006-11e6-9289-ac72891c3257	d4ee907c-b00f-11e6-a1f0-ac72891c3257	f7e37f76-562c-11e6-a2a4-ac72891c3257	Temporal Maximum, Global field (single level) [XY-na] [tmax]					AerChemMIP,C4MIP,CMIP,GMMIP,GeoMIP,HighResMIP,LS3MIP,OMIP	OMIP	All			
Omon	1	Surface Dissolved Oxygen Concentration	mol m-3	'Mole concentration' means number of moles per unit volume, also called 'molarity', and is used in the construction mole_concentration_of_X_in_Y, where X is a material constituent of Y.  A chemical or biological species denoted by X may be described by a single term such as 'nitrogen' or a phrase such as 'nox_expressed_as_nitrogen'.		o2os	mole_concentration_of_dissolved_molecular_oxygen_in_sea_water	area: mean where sea time: mean		real	longitude latitude time	o2os	ocnBgchem	mon	area: areacello	Omon ((isd.003))	Omon_oth	30	c918f7d0-c5e8-11e6-84e6-5404a60d96b5	c96d9daa-c5f0-11e6-ac20-5404a60d96b5	e9f9f6ca-c1ce-11e6-8067-ac72891c3257	Temporal mean, Global field (single level) [XY-na] [amse-tmn]					AerChemMIP,C4MIP,CMIP,DCPP,GMMIP,GeoMIP,HighResMIP,LS3MIP,OMIP,PAMIP,VIACSAB	OMIP	All			
Omon	1	Minimum Ocean Mixed Layer Thickness Defined by Sigma T	m	Sigma T is potential density referenced to ocean surface.		mlotstmin	ocean_mixed_layer_thickness_defined_by_sigma_t	area: mean time: minimum		real	longitude latitude time	mlotstmin	ocean	mon	area: areacello	Omon ((isd.003))	Omon_oth	31	1aab4e7a-b006-11e6-9289-ac72891c3257	d4ee9e5a-b00f-11e6-a1f0-ac72891c3257	63c08088-15f2-11e7-87e0-5404a60d96b5	Temporal mean, Global field (single level) [XY-na] [tmin]					AerChemMIP,C4MIP,CMIP,GMMIP,GeoMIP,HighResMIP,LS3MIP,OMIP	OMIP	All			
Omon	1	Surface Dissolved Oxygen Concentration at Saturation	mol m-3	'Mole concentration at saturation' means the mole concentration in a saturated solution. Mole concentration means number of moles per unit volume, also called 'molarity', and is used in the construction 'mole_concentration_of_X_in_Y', where X is a material constituent of Y. A chemical or biological species denoted by X may be described by a single term such as 'nitrogen' or a phrase such as 'nox_expressed_as_nitrogen'.		o2satos	mole_concentration_of_dissolved_molecular_oxygen_in_sea_water_at_saturation	area: mean where sea time: mean		real	longitude latitude time	o2satos	ocnBgchem	mon	area: areacello	Omon ((isd.003))	Omon_oth	31	c91905cc-c5e8-11e6-84e6-5404a60d96b5	c96daba6-c5f0-11e6-ac20-5404a60d96b5	e9f9f6ca-c1ce-11e6-8067-ac72891c3257	Temporal mean, Global field (single level) [XY-na] [amse-tmn]					AerChemMIP,C4MIP,CMIP,GMMIP,GeoMIP,HighResMIP,LS3MIP,OMIP	OMIP	All			
Omon	1	Surface Dissolved Nitrate Concentration	mol m-3	Mole concentration means moles (amount of substance) per unit volume and is used in the construction mole_concentration_of_X_in_Y, where X is a material constituent of Y.		no3os	mole_concentration_of_nitrate_in_sea_water	area: mean where sea time: mean		real	longitude latitude time	no3os	ocnBgchem	mon	area: areacello	Omon ((isd.003))	Omon_oth	32	c91915f8-c5e8-11e6-84e6-5404a60d96b5	c96db98e-c5f0-11e6-ac20-5404a60d96b5	e9f9f6ca-c1ce-11e6-8067-ac72891c3257	Temporal mean, Global field (single level) [XY-na] [amse-tmn]					AerChemMIP,C4MIP,CMIP,DCPP,GMMIP,GeoMIP,HighResMIP,LS3MIP,OMIP,PAMIP,VIACSAB	OMIP	All			
Omon	1	Square of Brunt Vaisala Frequency in Sea Water	s-2	The phrase 'square_of_X' means X*X. Frequency is the number of oscillations of a wave per unit time. Brunt-Vaisala frequency is also sometimes called 'buoyancy frequency' and is a measure of the vertical stratification of the medium.		obvfsq	square_of_brunt_vaisala_frequency_in_sea_water	area: mean where sea time: mean		real	longitude latitude olevel time	obvfsq	ocean	mon	area: areacello volume: volcello	Omon ((isd.003))	Omon_3d	32	1aab5d20-b006-11e6-9289-ac72891c3257	d4eeac2e-b00f-11e6-a1f0-ac72891c3257	f7e4000e-562c-11e6-a2a4-ac72891c3257	Temporal mean, Global ocean field on model levels [XY-O] [tmean]					AerChemMIP,C4MIP,CMIP,GMMIP,GeoMIP,HighResMIP,LS3MIP,OMIP	OMIP	All			
Omon	2	Surface Dissolved Ammonium Concentration	mol m-3	Mole concentration means moles (amount of substance) per unit volume and is used in the construction mole_concentration_of_X_in_Y, where X is a material constituent of Y.		nh4os	mole_concentration_of_ammonium_in_sea_water	area: mean where sea time: mean		real	longitude latitude time	nh4os	ocnBgchem	mon	area: areacello	Omon ((isd.003))	Omon_oth	33	c9192462-c5e8-11e6-84e6-5404a60d96b5	c96dc79e-c5f0-11e6-ac20-5404a60d96b5	e9f9f6ca-c1ce-11e6-8067-ac72891c3257	Temporal mean, Global field (single level) [XY-na] [amse-tmn]					AerChemMIP,C4MIP,CMIP,GMMIP,GeoMIP,HighResMIP,LS3MIP,OMIP	OMIP	All			
Omon	1	Sea Water X Velocity	m s-1	Prognostic x-ward velocity component resolved by the model.		uo	sea_water_x_velocity	time: mean		real	longitude latitude olevel time	uo	ocean	mon	--OPT	Omon ((isd.003))	Omon_3d	33	baa586e6-e5dd-11e5-8482-ac72891c3257	1ed3e3be3675e589a5327ce82016ab72	00b8a31e-8f1d-11e6-a5a6-ac72891c3257	Temporal mean, Global ocean field on model levels [XY-O] [tmean]					AerChemMIP,C4MIP,CDRMIP,CFMIP,CMIP,DAMIP,DCPP,GMMIP,GeoMIP,HighResMIP,LS3MIP,OMIP,PAMIP,VIACSAB,VolMIP	CMIP,OMIP	All			
Omon	1	Surface Total Dissolved Inorganic Phosphorus Concentration	mol m-3	Mole concentration means number of moles per unit volume, also called 'molarity', and is used in the construction 'mole_concentration_of_X_in_Y', where X is a material constituent of Y. A chemical or biological species denoted by X may be described by a single term such as 'nitrogen' or a phrase such as 'nox_expressed_as_nitrogen'. 'Dissolved inorganic phosphorus' means the sum of all inorganic phosphorus in solution (including phosphate, hydrogen phosphate, dihydrogen phosphate, and phosphoric acid).		po4os	mole_concentration_of_dissolved_inorganic_phosphorus_in_sea_water	area: mean where sea time: mean		real	longitude latitude time	po4os	ocnBgchem	mon	area: areacello	Omon ((isd.003))	Omon_oth	34	c919320e-c5e8-11e6-84e6-5404a60d96b5	c96dd518-c5f0-11e6-ac20-5404a60d96b5	e9f9f6ca-c1ce-11e6-8067-ac72891c3257	Temporal mean, Global field (single level) [XY-na] [amse-tmn]					AerChemMIP,C4MIP,CMIP,GMMIP,GeoMIP,HighResMIP,LS3MIP,OMIP	OMIP	All			
Omon	1	Sea Water Y Velocity	m s-1	Prognostic y-ward velocity component resolved by the model.		vo	sea_water_y_velocity	time: mean		real	longitude latitude olevel time	vo	ocean	mon	--OPT	Omon ((isd.003))	Omon_3d	34	baa58b1e-e5dd-11e5-8482-ac72891c3257	3e3ddc77800e7d421834b9cb808602d7	00b8a31e-8f1d-11e6-a5a6-ac72891c3257	Temporal mean, Global ocean field on model levels [XY-O] [tmean]					AerChemMIP,C4MIP,CDRMIP,CFMIP,CMIP,DAMIP,DCPP,GMMIP,GeoMIP,HighResMIP,LS3MIP,OMIP,PAMIP,VIACSAB,VolMIP	CMIP,OMIP	All			
Omon	1	Surface Dissolved Iron Concentration	mol m-3	dissolved iron in sea water is meant to include both Fe2+ and Fe3+ ions (but not, e.g., particulate detrital iron)		dfeos	mole_concentration_of_dissolved_iron_in_sea_water	area: mean where sea time: mean		real	longitude latitude time	dfeos	ocnBgchem	mon	area: areacello	Omon ((isd.003))	Omon_oth	35	c9194000-c5e8-11e6-84e6-5404a60d96b5	c96de29c-c5f0-11e6-ac20-5404a60d96b5	e9f9f6ca-c1ce-11e6-8067-ac72891c3257	Temporal mean, Global field (single level) [XY-na] [amse-tmn]					AerChemMIP,C4MIP,CMIP,DCPP,GMMIP,GeoMIP,HighResMIP,LS3MIP,OMIP,PAMIP,VIACSAB	OMIP	All			
Omon	1	Sea Water Vertical Velocity	m s-1	A velocity is a vector quantity. 'Upward' indicates a vector component which is positive when directed upward (negative downward).	Prognostic z-ward velocity component resolved by the model.	wo	upward_sea_water_velocity	time: mean		real	longitude latitude olevel time	wo	ocean	mon	--OPT	Omon ((isd.003))	Omon_3d	35	1aab80fc-b006-11e6-9289-ac72891c3257	d476e6113f5c466d27fd3aa9e9c35411	00b8a31e-8f1d-11e6-a5a6-ac72891c3257	Temporal mean, Global ocean field on model levels [XY-O] [tmean]					AerChemMIP,C4MIP,CMIP,GMMIP,GeoMIP,HighResMIP,LS3MIP,OMIP,PMIP	OMIP	All			
Omon	1	Surface Total Dissolved Inorganic Silicon Concentration	mol m-3	Mole concentration means number of moles per unit volume, also called 'molarity', and is used in the construction 'mole_concentration_of_X_in_Y', where X is a material constituent of Y. A chemical or biological species denoted by X may be described by a single term such as 'nitrogen' or a phrase such as 'nox_expressed_as_nitrogen'. 'Dissolved inorganic silicon' means the sum of all inorganic silicon in solution (including silicic acid and its first dissociated anion SiO(OH)3-).		sios	mole_concentration_of_dissolved_inorganic_silicon_in_sea_water	area: mean where sea time: mean		real	longitude latitude time	sios	ocnBgchem	mon	area: areacello	Omon ((isd.003))	Omon_oth	36	c9194dd4-c5e8-11e6-84e6-5404a60d96b5	c96df0fc-c5f0-11e6-ac20-5404a60d96b5	e9f9f6ca-c1ce-11e6-8067-ac72891c3257	Temporal mean, Global field (single level) [XY-na] [amse-tmn]					AerChemMIP,C4MIP,CMIP,DCPP,GMMIP,GeoMIP,HighResMIP,LS3MIP,OMIP,PAMIP,VIACSAB	OMIP	All			
Omon	1	Upward Ocean Mass Transport	kg s-1	Upward mass transport from resolved and parameterized advective transport.	Upward mass transport from residual mean (resolved plus parameterized) advective transport.	wmo	upward_ocean_mass_transport	area: sum where sea time: mean		real	longitude latitude olevel time	wmo	ocean	mon	area: areacello volume: volcello	Omon ((isd.003))	Omon_3d	36	baa58f74-e5dd-11e5-8482-ac72891c3257	05b30c1e249f6854ffc0b3f7676eed73	3c406380-76f7-11e9-9427-a44cc8186c64	Temporal mean, Global ocean field on model levels [XY-O] [asm-tmean]					AerChemMIP,C4MIP,CFMIP,CMIP,DAMIP,DCPP,GMMIP,GeoMIP,HighResMIP,LS3MIP,OMIP,PAMIP,VIACSAB	OMIP	All			
Omon	1	Surface Mass Concentration of Total Phytoplankton Expressed as Chlorophyll in Sea Water	kg m-3	Sum of chlorophyll from all phytoplankton group concentrations at the sea surface.  In most models this is equal to chldiat+chlmisc, that is the sum of 'Diatom Chlorophyll Mass Concentration' plus 'Other Phytoplankton Chlorophyll Mass Concentration'	sum of chlorophyll from all phytoplankton group concentrations.  In most models this is equal to chldiat+chlmisc, that is the sum of 'Diatom Chlorophyll Mass Concentration' plus 'Other Phytoplankton Chlorophyll Mass Concentration'	chlos	mass_concentration_of_phytoplankton_expressed_as_chlorophyll_in_sea_water	area: mean where sea time: mean		real	longitude latitude time	chlos	ocnBgchem	mon	area: areacello	Omon ((isd.003))	Omon_oth	37	c9195d60-c5e8-11e6-84e6-5404a60d96b5	1c757370cf83e5619efc0de4d1241f47	e9f9f6ca-c1ce-11e6-8067-ac72891c3257	Temporal mean, Global field (single level) [XY-na] [amse-tmn]					AerChemMIP,C4MIP,CMIP,DCPP,GMMIP,GeoMIP,HighResMIP,LS3MIP,OMIP,PAMIP,VIACSAB	OMIP	All			
Omon	1	Ocean Mass X Transport	kg s-1	X-ward mass transport from resolved and parameterized advective transport.	X-ward mass transport from residual mean (resolved plus parameterized) advective transport.	umo	ocean_mass_x_transport	time: mean		real	longitude latitude olevel time	umo	ocean	mon	--OPT	Omon ((isd.003))	Omon_3d	37	baa5942e-e5dd-11e5-8482-ac72891c3257	2f074f3417a26ad322b96dd0b6c21e09	00b8a31e-8f1d-11e6-a5a6-ac72891c3257	Temporal mean, Global ocean field on model levels [XY-O] [tmean]					AerChemMIP,C4MIP,CFMIP,CMIP,GMMIP,GeoMIP,HighResMIP,LS3MIP,OMIP,VIACSAB	OMIP	All			
Omon	3	Surface Mass Concentration of Diatoms Expressed as Chlorophyll in Sea Water	kg m-3	chlorophyll from diatom phytoplankton component concentration alone		chldiatos	mass_concentration_of_diatoms_expressed_as_chlorophyll_in_sea_water	area: mean where sea time: mean		real	longitude latitude time	chldiatos	ocnBgchem	mon	area: areacello	Omon ((isd.003))	Omon_oth	38	c9196b52-c5e8-11e6-84e6-5404a60d96b5	c96e0c22-c5f0-11e6-ac20-5404a60d96b5	e9f9f6ca-c1ce-11e6-8067-ac72891c3257	Temporal mean, Global field (single level) [XY-na] [amse-tmn]					AerChemMIP,C4MIP,CMIP,GMMIP,GeoMIP,HighResMIP,LS3MIP,OMIP,VIACSAB	OMIP	All			
Omon	1	Ocean Mass Y Transport	kg s-1	Y-ward mass transport from resolved and parameterized advective transport.	Y-ward mass transport from residual mean (resolved plus parameterized) advective transport.	vmo	ocean_mass_y_transport	time: mean		real	longitude latitude olevel time	vmo	ocean	mon	--OPT	Omon ((isd.003))	Omon_3d	38	baa598c0-e5dd-11e5-8482-ac72891c3257	f7fdcc15d14c0066a9590e4bce820056	00b8a31e-8f1d-11e6-a5a6-ac72891c3257	Temporal mean, Global ocean field on model levels [XY-O] [tmean]					AerChemMIP,C4MIP,CFMIP,CMIP,GMMIP,GeoMIP,HighResMIP,LS3MIP,OMIP,VIACSAB	OMIP	All			
Omon	3	Surface Mass Concentration of Diazotrophs Expressed as Chlorophyll in Sea Water	kg m-3	chlorophyll concentration from the diazotrophic phytoplankton component alone		chldiazos	mass_concentration_of_diazotrophs_expressed_as_chlorophyll_in_sea_water	area: mean where sea time: mean		real	longitude latitude time	chldiazos	ocnBgchem	mon	area: areacello	Omon ((isd.003))	Omon_oth	39	c91979b2-c5e8-11e6-84e6-5404a60d96b5	c96e19b0-c5f0-11e6-ac20-5404a60d96b5	e9f9f6ca-c1ce-11e6-8067-ac72891c3257	Temporal mean, Global field (single level) [XY-na] [amse-tmn]					AerChemMIP,C4MIP,CMIP,GMMIP,GeoMIP,HighResMIP,LS3MIP,OMIP,VIACSAB	OMIP	All			
Omon	1	Ocean Meridional Overturning Mass Streamfunction	kg s-1	Overturning mass streamfunction arising from all advective mass transport processes, resolved and parameterized.		msftmz	ocean_meridional_overturning_mass_streamfunction	longitude: sum (comment: basin sum [along zig-zag grid path]) depth: sum time: mean		real	latitude olevel basin time	msftmz	ocean	mon		Omon ((isd.003))	Omon_oth	39	baa59d48-e5dd-11e5-8482-ac72891c3257	fe8d7416c92bdae56503590599286800	529e94b4-1ed7-11e7-9366-ac72891c3257	Temporal mean, Ocean Basin Meridional Section [YB-O] [bzzsum]					AerChemMIP,C4MIP,CMIP,DAMIP,DCPP,GMMIP,GeoMIP,HighResMIP,LS3MIP,OMIP,PAMIP,VolMIP	CMIP,OMIP	All			
Omon	3	Surface Mass Concentration of Calcareous Phytoplankton Expressed as Chlorophyll in Sea Water	kg m-3	chlorophyll concentration from the calcite-producing phytoplankton component alone		chlcalcos	mass_concentration_of_calcareous_phytoplankton_expressed_as_chlorophyll_in_sea_water	area: mean where sea time: mean		real	longitude latitude time	chlcalcos	ocnBgchem	mon	area: areacello	Omon ((isd.003))	Omon_oth	40	c919877c-c5e8-11e6-84e6-5404a60d96b5	c96e2752-c5f0-11e6-ac20-5404a60d96b5	e9f9f6ca-c1ce-11e6-8067-ac72891c3257	Temporal mean, Global field (single level) [XY-na] [amse-tmn]					AerChemMIP,C4MIP,CMIP,GMMIP,GeoMIP,HighResMIP,LS3MIP,OMIP,VIACSAB	OMIP	All			
Omon	1	Ocean Meridional Overturning Mass Streamfunction	kg s-1	Overturning mass streamfunction arising from all advective mass transport processes, resolved and parameterized.		msftmrho	ocean_meridional_overturning_mass_streamfunction	longitude: sum (comment: basin sum [along zig-zag grid path]) depth: sum time: mean		real	latitude rho basin time	msftmrho	ocean	mon		Omon ((isd.003))	Omon_oth	40	baa5a1da-e5dd-11e5-8482-ac72891c3257	faeffb2438794e8400143533d61d1623	529d537e-1ed7-11e7-9366-ac72891c3257	Temporal mean, Ocean Basin Meridional Section (on density surfaces) [YB-R] [bzzsum]					AerChemMIP,C4MIP,CMIP,DAMIP,GMMIP,GeoMIP,HighResMIP,LS3MIP,OMIP,VolMIP	OMIP	All			
Omon	3	Surface Mass Concentration of Picophytoplankton Expressed as Chlorophyll in Sea Water	kg m-3	chlorophyll concentration from the picophytoplankton (<2 um) component alone		chlpicoos	mass_concentration_of_picophytoplankton_expressed_as_chlorophyll_in_sea_water	area: mean where sea time: mean		real	longitude latitude time	chlpicoos	ocnBgchem	mon	area: areacello	Omon ((isd.003))	Omon_oth	41	c919953c-c5e8-11e6-84e6-5404a60d96b5	c96e35a8-c5f0-11e6-ac20-5404a60d96b5	e9f9f6ca-c1ce-11e6-8067-ac72891c3257	Temporal mean, Global field (single level) [XY-na] [amse-tmn]					AerChemMIP,C4MIP,CMIP,GMMIP,GeoMIP,HighResMIP,LS3MIP,OMIP,VIACSAB	OMIP	All			
Omon	1	Ocean Y Overturning Mass Streamfunction	kg s-1	Overturning mass streamfunction arising from all advective mass transport processes, resolved and parameterized.		msftyz	ocean_y_overturning_mass_streamfunction	time: mean grid_longitude: mean		real	gridlatitude olevel basin time	msftyz	ocean	mon		Omon ((isd.003))	Omon_oth	41	baa5a662-e5dd-11e5-8482-ac72891c3257	59cc645887ed0a072bb553283e15f732	529d9136-1ed7-11e7-9366-ac72891c3257	Temporal mean, Ocean Basin Meridional Section [YB-O] [bgzmean]					AerChemMIP,C4MIP,CDRMIP,CMIP,DAMIP,GMMIP,GeoMIP,HighResMIP,LS3MIP,OMIP	OMIP	All			
Omon	3	Surface Mass Concentration of Other Phytoplankton Expressed as Chlorophyll in Sea Water	kg m-3	chlorophyll from additional phytoplankton component concentrations alone		chlmiscos	mass_concentration_of_miscellaneous_phytoplankton_expressed_as_chlorophyll_in_sea_water	area: mean where sea time: mean		real	longitude latitude time	chlmiscos	ocnBgchem	mon	area: areacello	Omon ((isd.003))	Omon_oth	42	c919a342-c5e8-11e6-84e6-5404a60d96b5	c96e439a-c5f0-11e6-ac20-5404a60d96b5	e9f9f6ca-c1ce-11e6-8067-ac72891c3257	Temporal mean, Global field (single level) [XY-na] [amse-tmn]					AerChemMIP,C4MIP,CMIP,GMMIP,GeoMIP,HighResMIP,LS3MIP,OMIP,VIACSAB	OMIP	All			
Omon	1	Ocean Y Overturning Mass Streamfunction	kg s-1	Overturning mass streamfunction arising from all advective mass transport processes, resolved and parameterized.		msftyrho	ocean_y_overturning_mass_streamfunction	time: mean grid_longitude: mean		real	gridlatitude rho basin time	msftyrho	ocean	mon		Omon ((isd.003))	Omon_oth	42	baa5aafe-e5dd-11e5-8482-ac72891c3257	29a3aaf848070fb8ff4ecb7aa2dfa2eb	529d692c-1ed7-11e7-9366-ac72891c3257	Temporal mean, Ocean Basin Meridional Section (on density surfaces) [YB-R] [bgzmean]					AerChemMIP,C4MIP,CMIP,DAMIP,GMMIP,GeoMIP,HighResMIP,LS3MIP,OMIP	OMIP	All			
Omon	1	Ocean Meridional Overturning Mass Streamfunction Due to Parameterized Mesoscale Advection	kg s-1	CMIP5 called this 'due to Bolus Advection'.  Name change respects the more general physics of the mesoscale parameterizations.		msftmzmpa	ocean_meridional_overturning_mass_streamfunction_due_to_parameterized_mesoscale_eddy_advection	longitude: sum (comment: basin sum [along zig-zag grid path]) depth: sum time: mean		real	latitude olevel basin time	msftmzmpa	ocean	mon		Omon ((isd.003))	Omon_oth	43	baa5af36-e5dd-11e5-8482-ac72891c3257	bd75f065fbaddd5d92f4767c6d6baaff	529e94b4-1ed7-11e7-9366-ac72891c3257	Temporal mean, Ocean Basin Meridional Section [YB-O] [bzzsum]					AerChemMIP,C4MIP,CMIP,DAMIP,DCPP,GMMIP,GeoMIP,HighResMIP,LS3MIP,OMIP,PAMIP	OMIP	All			
Omon	3	Surface Mole Concentration of Particulate Organic Matter Expressed as Nitrogen in Sea Water	mol m-3	sum of particulate organic nitrogen component concentrations		ponos	mole_concentration_of_particulate_organic_matter_expressed_as_nitrogen_in_sea_water	area: mean where sea time: mean		real	longitude latitude time	ponos	ocnBgchem	mon	area: areacello	Omon ((isd.003))	Omon_oth	43	c919b7b0-c5e8-11e6-84e6-5404a60d96b5	c96e5132-c5f0-11e6-ac20-5404a60d96b5	e9f9f6ca-c1ce-11e6-8067-ac72891c3257	Temporal mean, Global field (single level) [XY-na] [amse-tmn]					AerChemMIP,C4MIP,CMIP,GMMIP,GeoMIP,HighResMIP,LS3MIP,OMIP,VIACSAB	OMIP	All			
Omon	1	Ocean Meridional Overturning Mass Streamfunction Due to Parameterized Mesoscale Advection	kg s-1	CMIP5 called this 'due to Bolus Advection'.  Name change respects the more general physics of the mesoscale parameterizations.		msftmrhompa	ocean_meridional_overturning_mass_streamfunction_due_to_parameterized_mesoscale_eddy_advection	longitude: sum (comment: basin sum [along zig-zag grid path]) depth: sum time: mean		real	latitude rho basin time	msftmrhompa	ocean	mon		Omon ((isd.003))	Omon_oth	44	baa5b364-e5dd-11e5-8482-ac72891c3257	54bc1fc90fca4b22cd73cc18e3f6ec07	529d537e-1ed7-11e7-9366-ac72891c3257	Temporal mean, Ocean Basin Meridional Section (on density surfaces) [YB-R] [bzzsum]					AerChemMIP,C4MIP,CMIP,DAMIP,GMMIP,GeoMIP,HighResMIP,LS3MIP,OMIP	OMIP	All			
