Notes		Notes on tables
Oyr	2	Mole Concentration of Particulate Organic Matter Expressed as Phosphorus in Sea Water	mol m-3	sum of particulate organic phosphorus component concentrations		pop	mole_concentration_of_particulate_organic_matter_expressed_as_phosphorus_in_sea_water	area: mean where sea time: mean		real	longitude latitude olevel time	pop	ocnBgchem	yr	area: areacello volume: volcello	Oyr ((isd.003))	Oyr_3dtr	43	ba9e540c-e5dd-11e5-8482-ac72891c3257	562c99ff069851867df730ed9531c796	f7e4000e-562c-11e6-a2a4-ac72891c3257	Temporal mean, Global ocean field on model levels [XY-O] [tmean]					AerChemMIP,CMIP,GeoMIP,LUMIP,OMIP	OMIP	All			
Oyr	2	Mole Concentration of Particulate Organic Matter Expressed as Iron in Sea Water	mol m-3	Sum of particulate organic iron component concentrations	sum of particulate organic iron component concentrations	bfe	mole_concentration_of_particulate_organic_matter_expressed_as_iron_in_sea_water	area: mean where sea time: mean		real	longitude latitude olevel time	bfe	ocnBgchem	yr	area: areacello volume: volcello	Oyr ((isd.003))	Oyr_3dtr	44	ba9e583a-e5dd-11e5-8482-ac72891c3257	f108633dc7e1585498ceccc06bdfd263	f7e4000e-562c-11e6-a2a4-ac72891c3257	Temporal mean, Global ocean field on model levels [XY-O] [tmean]					AerChemMIP,CMIP,GeoMIP,LUMIP,OMIP	OMIP	All			
Oyr	2	Mole Concentration of Particulate Organic Matter Expressed as Silicon in Sea Water	mol m-3	Sum of particulate silica component concentrations	sum of particulate silica component concentrations	bsi	mole_concentration_of_particulate_matter_expressed_as_silicon_in_sea_water	area: mean where sea time: mean		real	longitude latitude olevel time	bsi	ocnBgchem	yr	area: areacello volume: volcello	Oyr ((isd.003))	Oyr_3dtr	45	ba9e5c72-e5dd-11e5-8482-ac72891c3257	dcd2298237af35be0ed71c92ee9e7e79	f7e4000e-562c-11e6-a2a4-ac72891c3257	Temporal mean, Global ocean field on model levels [XY-O] [tmean]					AerChemMIP,CMIP,GeoMIP,LUMIP,OMIP	OMIP	All			
Oyr	2	Mole Concentration of Total Phytoplankton Expressed as Nitrogen in Sea Water	mol m-3	sum of phytoplankton nitrogen component concentrations		phyn	mole_concentration_of_phytoplankton_expressed_as_nitrogen_in_sea_water	area: mean where sea time: mean		real	longitude latitude olevel time	phyn	ocnBgchem	yr	area: areacello volume: volcello	Oyr ((isd.003))	Oyr_3dtr	46	ba9e60aa-e5dd-11e5-8482-ac72891c3257	80f337469efdd0d5392ad995a90fd15c	f7e4000e-562c-11e6-a2a4-ac72891c3257	Temporal mean, Global ocean field on model levels [XY-O] [tmean]					AerChemMIP,CMIP,GeoMIP,LUMIP,OMIP	OMIP	All			
Oyr	2	Mole Concentration of Total Phytoplankton Expressed as Phosphorus in Sea Water	mol m-3	sum of phytoplankton phosphorus components		phyp	mole_concentration_of_phytoplankton_expressed_as_phosphorus_in_sea_water	area: mean where sea time: mean		real	longitude latitude olevel time	phyp	ocnBgchem	yr	area: areacello volume: volcello	Oyr ((isd.003))	Oyr_3dtr	47	ba9e64ec-e5dd-11e5-8482-ac72891c3257	1ae710e405acc14b368f55d9205be258	f7e4000e-562c-11e6-a2a4-ac72891c3257	Temporal mean, Global ocean field on model levels [XY-O] [tmean]					AerChemMIP,CMIP,GeoMIP,LUMIP,OMIP	OMIP	All			
Oyr	2	Mole Concentration of Total Phytoplankton Expressed as Iron in Sea Water	mol m-3	sum of phytoplankton iron component concentrations		phyfe	mole_concentration_of_phytoplankton_expressed_as_iron_in_sea_water	area: mean where sea time: mean		real	longitude latitude olevel time	phyfe	ocnBgchem	yr	area: areacello volume: volcello	Oyr ((isd.003))	Oyr_3dtr	48	ba9e691a-e5dd-11e5-8482-ac72891c3257	87f531b94bd9ca68e33e89d7e3e81be4	f7e4000e-562c-11e6-a2a4-ac72891c3257	Temporal mean, Global ocean field on model levels [XY-O] [tmean]					AerChemMIP,CMIP,GeoMIP,LUMIP,OMIP	OMIP	All			
Oyr	2	Mole Concentration of Total Phytoplankton Expressed as Silicon in Sea Water	mol m-3	sum of phytoplankton silica component concentrations		physi	mole_concentration_of_phytoplankton_expressed_as_silicon_in_sea_water	area: mean where sea time: mean		real	longitude latitude olevel time	physi	ocnBgchem	yr	area: areacello volume: volcello	Oyr ((isd.003))	Oyr_3dtr	49	ba9e6d5c-e5dd-11e5-8482-ac72891c3257	6cde3055df67931d84608fc5b7694f65	f7e4000e-562c-11e6-a2a4-ac72891c3257	Temporal mean, Global ocean field on model levels [XY-O] [tmean]					AerChemMIP,CMIP,GeoMIP,LUMIP,OMIP	OMIP	All			
Oyr	2	Mole Concentration of Dimethyl Sulphide in Sea Water	mol m-3	Mole concentration of dimethyl sulphide in water		dmso	mole_concentration_of_dimethyl_sulfide_in_sea_water	area: mean where sea time: mean		real	longitude latitude olevel time	dmso	ocnBgchem	yr	area: areacello volume: volcello	Oyr ((isd.003))	Oyr_3dtr	50	ba9e7180-e5dd-11e5-8482-ac72891c3257	bdce9878-233e-11e6-a788-5404a60d96b5	f7e4000e-562c-11e6-a2a4-ac72891c3257	Temporal mean, Global ocean field on model levels [XY-O] [tmean]					AerChemMIP,CMIP,GeoMIP,LUMIP,OMIP,VIACSAB	OMIP	All			
Oyr	2	Carbonate Ion Concentration	mol m-3	Mole concentration (number of moles per unit volume: molarity) of the carbonate anion (CO3).		co3	mole_concentration_of_carbonate_expressed_as_carbon_in_sea_water	area: mean where sea time: mean		real	longitude latitude olevel time	co3	ocnBgchem	yr	area: areacello volume: volcello	Oyr ((isd.003))	Oyr_3dtr	51	ba9e75ae-e5dd-11e5-8482-ac72891c3257	9791ce56083fe450761a27a7dc158225	f7e4000e-562c-11e6-a2a4-ac72891c3257	Temporal mean, Global ocean field on model levels [XY-O] [tmean]					AerChemMIP,CMIP,GeoMIP,LUMIP,OMIP,VIACSAB	OMIP	All			
Oyr	2	Natural Carbonate Ion Concentration	mol m-3	Surface mole concentration (number of moles per unit volume: molarity) of the natural-analogue carbonate anion (CO3). A natural analogue is used to simulate the effect on a modelled variable of imposing preindustrial atmospheric carbon dioxide concentrations, even when the model as a whole may be subjected to varying forcings. 		co3nat	mole_concentration_of_carbonate_natural_analogue_expressed_as_carbon_in_sea_water	area: mean where sea time: mean		real	longitude latitude olevel time	co3nat	ocnBgchem	yr	area: areacello volume: volcello	Oyr ((isd.003))	Oyr_3dtr	52	c924dc6c-c5e8-11e6-84e6-5404a60d96b5	c9793390-c5f0-11e6-ac20-5404a60d96b5	f7e4000e-562c-11e6-a2a4-ac72891c3257	Temporal mean, Global ocean field on model levels [XY-O] [tmean]					AerChemMIP,CMIP,GeoMIP,LUMIP,OMIP	OMIP	All			
Oyr	2	Abiotic Carbonate Ion Concentration	mol m-3	Mole concentration (number of moles per unit volume: molarity) of the abiotic-analogue carbonate anion (CO3). An abiotic analogue is used to simulate the effect on a modelled variable when biological effects on ocean carbon concentration and alkalinity are ignored. 		co3abio	mole_concentration_of_carbonate_abiotic_analogue_expressed_as_carbon_in_sea_water	area: mean where sea time: mean		real	longitude latitude olevel time	co3abio	ocnBgchem	yr	area: areacello volume: volcello	Oyr ((isd.003))	Oyr_3dtr	53	c924f382-c5e8-11e6-84e6-5404a60d96b5	c9794182-c5f0-11e6-ac20-5404a60d96b5	f7e4000e-562c-11e6-a2a4-ac72891c3257	Temporal mean, Global ocean field on model levels [XY-O] [tmean]					AerChemMIP,CMIP,GeoMIP,LUMIP,OMIP	OMIP	All			
Oyr	2	Mole Concentration of Carbonate Ion in Equilibrium with Pure Calcite in Sea Water	mol m-3	Mole concentration (number of moles per unit volume: molarity) of the carbonate anion (CO3) for sea water in equilibrium with pure calcite. Aragonite  (CaCO3) is a mineral that is a polymorph of calcium carbonate.		co3satcalc	mole_concentration_of_carbonate_expressed_as_carbon_at_equilibrium_with_pure_calcite_in_sea_water	area: mean where sea time: mean		real	longitude latitude olevel time	co3satcalc	ocnBgchem	yr	area: areacello volume: volcello	Oyr ((isd.003))	Oyr_3dtr	54	ba9e79d2-e5dd-11e5-8482-ac72891c3257	28907f4f1855d3d22166c87b8e5300be	f7e4000e-562c-11e6-a2a4-ac72891c3257	Temporal mean, Global ocean field on model levels [XY-O] [tmean]					AerChemMIP,CMIP,GeoMIP,LUMIP,OMIP,VIACSAB	OMIP	All			
Oyr	2	Mole Concentration of Carbonate Ion in Equilibrium with Pure Aragonite in Sea Water	mol m-3	Mole concentration (number of moles per unit volume: molarity) of the carbonate anion (CO3) for sea water in equilibrium with pure Aragonite. Aragonite  (CaCO3) is a mineral that is a polymorph of calcium carbonate.		co3satarag	mole_concentration_of_carbonate_expressed_as_carbon_at_equilibrium_with_pure_aragonite_in_sea_water	area: mean where sea time: mean		real	longitude latitude olevel time	co3satarag	ocnBgchem	yr	area: areacello volume: volcello	Oyr ((isd.003))	Oyr_3dtr	55	ba9e7df6-e5dd-11e5-8482-ac72891c3257	065edaa295c376f0e9bc1985bc3f491c	f7e4000e-562c-11e6-a2a4-ac72891c3257	Temporal mean, Global ocean field on model levels [XY-O] [tmean]					AerChemMIP,CMIP,GeoMIP,LUMIP,OMIP,VIACSAB	OMIP	All			
Oyr	2	Primary Carbon Production by Phytoplankton	mol m-3 s-1	total primary (organic carbon) production by phytoplankton		pp	tendency_of_mole_concentration_of_particulate_organic_matter_expressed_as_carbon_in_sea_water_due_to_net_primary_production	area: mean where sea time: mean		real	longitude latitude olevel time	pp	ocnBgchem	yr	area: areacello volume: volcello	Oyr ((isd.003))	Oyr_3dtr	56	ba9e8a26-e5dd-11e5-8482-ac72891c3257	41cef8aa37d1f0164ae061f293d4361c	f7e4000e-562c-11e6-a2a4-ac72891c3257	Temporal mean, Global ocean field on model levels [XY-O] [tmean]					AerChemMIP,CMIP,GeoMIP,LUMIP,OMIP,PMIP,VIACSAB	OMIP	All			
Oyr	2	Primary Carbon Production by Phytoplankton Due to Nitrate Uptake Alone	mol m-3 s-1	Primary (organic carbon) production by phytoplankton due to nitrate uptake alone		pnitrate	tendency_of_mole_concentration_of_particulate_organic_matter_expressed_as_carbon_in_sea_water_due_to_nitrate_utilization	area: mean where sea time: mean		real	longitude latitude olevel time	pnitrate	ocnBgchem	yr	area: areacello volume: volcello	Oyr ((isd.003))	Oyr_3dtr	57	ba9e8fb2-e5dd-11e5-8482-ac72891c3257	a3dd8da8b39dde98682ad859d8f5f5c2	f7e4000e-562c-11e6-a2a4-ac72891c3257	Temporal mean, Global ocean field on model levels [XY-O] [tmean]					AerChemMIP,CMIP,GeoMIP,LUMIP,OMIP,VIACSAB	OMIP	All			
Oyr	2	Biogenic Iron Production	mol m-3 s-1	'Mole concentration' means number of moles per unit volume, also called 'molarity', and is used in the construction mole_concentration_of_X_in_Y, where X is a material constituent of Y.  A chemical or biological species denoted by X may be described by a single term such as 'nitrogen' or a phrase such as 'nox_expressed_as_nitrogen'. The specification of a physical process by the phrase due_to_process means that the quantity named is a  single term in a sum of terms which together compose the general quantity  named by omitting the phrase.  'tendency_of_X' means derivative of X with respect to time.		pbfe	tendency_of_mole_concentration_of_iron_in_sea_water_due_to_biological_production	area: mean where sea time: mean		real	longitude latitude olevel time	pbfe	ocnBgchem	yr	area: areacello volume: volcello	Oyr ((isd.003))	Oyr_3dtr	58	ba9e9412-e5dd-11e5-8482-ac72891c3257	a336fa5c0a328636d04ea8f648dcd7c7	f7e4000e-562c-11e6-a2a4-ac72891c3257	Temporal mean, Global ocean field on model levels [XY-O] [tmean]					AerChemMIP,CMIP,GeoMIP,LUMIP,OMIP,VIACSAB	OMIP	All			
Oyr	2	Biogenic Silicon Production	mol m-3 s-1	'Mole concentration' means number of moles per unit volume, also called 'molarity', and is used in the construction mole_concentration_of_X_in_Y, where X is a material constituent of Y.  A chemical or biological species denoted by X may be described by a single term such as 'nitrogen' or a phrase such as 'nox_expressed_as_nitrogen'. The specification of a physical process by the phrase due_to_process means that the quantity named is a  single term in a sum of terms which together compose the general quantity  named by omitting the phrase.  'tendency_of_X' means derivative of X with respect to time.		pbsi	tendency_of_mole_concentration_of_silicon_in_sea_water_due_to_biological_production	area: mean where sea time: mean		real	longitude latitude olevel time	pbsi	ocnBgchem	yr	area: areacello volume: volcello	Oyr ((isd.003))	Oyr_3dtr	59	ba9e984a-e5dd-11e5-8482-ac72891c3257	683b8f723c94f4a3b3e65569b975d648	f7e4000e-562c-11e6-a2a4-ac72891c3257	Temporal mean, Global ocean field on model levels [XY-O] [tmean]					AerChemMIP,CMIP,GeoMIP,LUMIP,OMIP,VIACSAB	OMIP	All			
Oyr	2	Calcite Production	mol m-3 s-1	Production rate of Calcite, a mineral that is a polymorph of calcium carbonate. The chemical formula of calcite is CaCO3. 		pcalc	tendency_of_mole_concentration_of_calcite_expressed_as_carbon_in_sea_water_due_to_biological_production	area: mean where sea time: mean		real	longitude latitude olevel time	pcalc	ocnBgchem	yr	area: areacello volume: volcello	Oyr ((isd.003))	Oyr_3dtr	60	ba9e9c78-e5dd-11e5-8482-ac72891c3257	57235dfe47c3e04ac63a3c850ef16458	f7e4000e-562c-11e6-a2a4-ac72891c3257	Temporal mean, Global ocean field on model levels [XY-O] [tmean]					AerChemMIP,CMIP,GeoMIP,LUMIP,OMIP,VIACSAB	OMIP	All			
Oyr	2	Aragonite Production	mol m-3 s-1	Production rate of Aragonite, a mineral that is a polymorph of calcium carbonate. The chemical formula of aragonite is CaCO3.		parag	tendency_of_mole_concentration_of_aragonite_expressed_as_carbon_in_sea_water_due_to_biological_production	area: mean where sea time: mean		real	longitude latitude olevel time	parag	ocnBgchem	yr	area: areacello volume: volcello	Oyr ((isd.003))	Oyr_3dtr	61	ba9ea0b0-e5dd-11e5-8482-ac72891c3257	6aec29521de81a361630aac9ffc69f8f	f7e4000e-562c-11e6-a2a4-ac72891c3257	Temporal mean, Global ocean field on model levels [XY-O] [tmean]					AerChemMIP,CMIP,GeoMIP,LUMIP,OMIP,VIACSAB	OMIP	All			
Oyr	2	Downward Flux of Particulate Organic Carbon	mol m-2 s-1	Downward flux of particulate organic carbon		expc	sinking_mole_flux_of_particulate_organic_matter_expressed_as_carbon_in_sea_water	area: mean where sea time: mean	down	real	longitude latitude olevel time	expc	ocnBgchem	yr	area: areacello volume: volcello	Oyr ((isd.003))	Oyr_3dtr	62	ba9ea4e8-e5dd-11e5-8482-ac72891c3257	4f309d6b2d689c19254dccc24c66e32d	f7e4000e-562c-11e6-a2a4-ac72891c3257	Temporal mean, Global ocean field on model levels [XY-O] [tmean]					AerChemMIP,CMIP,GeoMIP,LUMIP,OMIP,PMIP,VIACSAB	OMIP	All			
Oyr	2	Sinking Particulate Organic Nitrogen Flux	mol m-2 s-1	In accordance with common usage in geophysical disciplines, 'flux' implies per unit area, called 'flux density' in physics.   'Sinking' is the gravitational settling of particulate matter suspended in a liquid. A sinking flux is positive downwards and is calculated relative to the movement of the surrounding fluid.		expn	sinking_mole_flux_of_particulate_organic_nitrogen_in_sea_water	area: mean where sea time: mean	down	real	longitude latitude olevel time	expn	ocnBgchem	yr	area: areacello volume: volcello	Oyr ((isd.003))	Oyr_3dtr	63	ba9ea916-e5dd-11e5-8482-ac72891c3257	6fc1dd9341ca569ad866695db9878618	f7e4000e-562c-11e6-a2a4-ac72891c3257	Temporal mean, Global ocean field on model levels [XY-O] [tmean]					AerChemMIP,CMIP,GeoMIP,LUMIP,OMIP,VIACSAB	OMIP	All			
Oyr	2	Sinking Particulate Organic Phosphorus Flux	mol m-2 s-1	In accordance with common usage in geophysical disciplines, 'flux' implies per unit area, called 'flux density' in physics.   'Sinking' is the gravitational settling of particulate matter suspended in a liquid. A sinking flux is positive downwards and is calculated relative to the movement of the surrounding fluid.		expp	sinking_mole_flux_of_particulate_organic_phosphorus_in_sea_water	area: mean where sea time: mean	down	real	longitude latitude olevel time	expp	ocnBgchem	yr	area: areacello volume: volcello	Oyr ((isd.003))	Oyr_3dtr	64	ba9ead44-e5dd-11e5-8482-ac72891c3257	60f0a8f8a0311f9c386e64e0b62cf3bd	f7e4000e-562c-11e6-a2a4-ac72891c3257	Temporal mean, Global ocean field on model levels [XY-O] [tmean]					AerChemMIP,CMIP,GeoMIP,LUMIP,OMIP,VIACSAB	OMIP	All			
Oyr	2	Sinking Particulate Iron Flux	mol m-2 s-1	In accordance with common usage in geophysical disciplines, 'flux' implies per unit area, called 'flux density' in physics.   'Sinking' is the gravitational settling of particulate matter suspended in a liquid. A sinking flux is positive downwards and is calculated relative to the movement of the surrounding fluid.		expfe	sinking_mole_flux_of_particulate_iron_in_sea_water	area: mean where sea time: mean	down	real	longitude latitude olevel time	expfe	ocnBgchem	yr	area: areacello volume: volcello	Oyr ((isd.003))		65	ba9eb172-e5dd-11e5-8482-ac72891c3257	e52528e8-dd83-11e5-9194-ac72891c3257	f7e4000e-562c-11e6-a2a4-ac72891c3257	Temporal mean, Global ocean field on model levels [XY-O] [tmean]					AerChemMIP,CMIP,GeoMIP,LUMIP,OMIP,VIACSAB	OMIP	All			
Oyr	2	Sinking Particulate Silicon Flux	mol m-2 s-1	In accordance with common usage in geophysical disciplines, 'flux' implies per unit area, called 'flux density' in physics.   'Sinking' is the gravitational settling of particulate matter suspended in a liquid. A sinking flux is positive downwards and is calculated relative to the movement of the surrounding fluid.		expsi	sinking_mole_flux_of_particulate_silicon_in_sea_water	area: mean where sea time: mean	down	real	longitude latitude olevel time	expsi	ocnBgchem	yr	area: areacello volume: volcello	Oyr ((isd.003))		66	ba9eb5a0-e5dd-11e5-8482-ac72891c3257	236430ceeb7aa3d23577b3a03d13f7fb	f7e4000e-562c-11e6-a2a4-ac72891c3257	Temporal mean, Global ocean field on model levels [XY-O] [tmean]					AerChemMIP,CMIP,GeoMIP,LUMIP,OMIP,PMIP,VIACSAB	OMIP	All			
Oyr	2	Downward Flux of Calcite	mol m-2 s-1	Downward flux of Calcite		expcalc	sinking_mole_flux_of_calcite_expressed_as_carbon_in_sea_water	area: mean where sea time: mean	down	real	longitude latitude olevel time	expcalc	ocnBgchem	yr	area: areacello volume: volcello	Oyr ((isd.003))		67	ba9eb9ce-e5dd-11e5-8482-ac72891c3257	71480abb30ae62d262fcea6cfdd753cf	f7e4000e-562c-11e6-a2a4-ac72891c3257	Temporal mean, Global ocean field on model levels [XY-O] [tmean]					AerChemMIP,CMIP,GeoMIP,LUMIP,OMIP,PMIP,VIACSAB	OMIP	All			
Oyr	2	Downward Flux of Aragonite	mol m-2 s-1	Downward flux of Aragonite		exparag	sinking_mole_flux_of_aragonite_expressed_as_carbon_in_sea_water	area: mean where sea time: mean	down	real	longitude latitude olevel time	exparag	ocnBgchem	yr	area: areacello volume: volcello	Oyr ((isd.003))		68	ba9ebdfc-e5dd-11e5-8482-ac72891c3257	684d3f3543045a89ecbb0ca81ba6705f	f7e4000e-562c-11e6-a2a4-ac72891c3257	Temporal mean, Global ocean field on model levels [XY-O] [tmean]					AerChemMIP,CMIP,GeoMIP,LUMIP,OMIP,VIACSAB	OMIP	All			
Oyr	2	Remineralization of Organic Carbon	mol m-3 s-1	Remineralization is the degradation of organic matter into inorganic forms of carbon, nitrogen, phosphorus and other micronutrients, which consumes oxygen and releases energy.		remoc	tendency_of_mole_concentration_of_particulate_organic_matter_expressed_as_carbon_in_sea_water_due_to_remineralization	area: mean where sea time: mean		real	longitude latitude olevel time	remoc	ocnBgchem	yr	area: areacello volume: volcello	Oyr ((isd.003))		69	ba9ec220-e5dd-11e5-8482-ac72891c3257	6b8715466e3423119e9642776eacb693	f7e4000e-562c-11e6-a2a4-ac72891c3257	Temporal mean, Global ocean field on model levels [XY-O] [tmean]					AerChemMIP,C4MIP,CMIP,GeoMIP,LUMIP,OMIP	OMIP	All			
Oyr	2	Calcite Dissolution	mol m-3 s-1	Rate of change of Calcite carbon mole concentration  due to dissolution		dcalc	tendency_of_mole_concentration_of_calcite_expressed_as_carbon_in_sea_water_due_to_dissolution	area: mean where sea time: mean		real	longitude latitude olevel time	dcalc	ocnBgchem	yr	area: areacello volume: volcello	Oyr ((isd.003))		70	ba9ec658-e5dd-11e5-8482-ac72891c3257	d14c09e91e6240dd9097dfad0a1853c8	f7e4000e-562c-11e6-a2a4-ac72891c3257	Temporal mean, Global ocean field on model levels [XY-O] [tmean]					AerChemMIP,CMIP,GeoMIP,LUMIP,OMIP,VIACSAB	OMIP	All			
Oyr	2	Aragonite Dissolution	mol m-3 s-1	Rate of change of Aragonite carbon mole concentration  due to dissolution		darag	tendency_of_mole_concentration_of_aragonite_expressed_as_carbon_in_sea_water_due_to_dissolution	area: mean where sea time: mean		real	longitude latitude olevel time	darag	ocnBgchem	yr	area: areacello volume: volcello	Oyr ((isd.003))		71	ba9ecaa4-e5dd-11e5-8482-ac72891c3257	402d88cf81105fe603118df92bb9eecb	f7e4000e-562c-11e6-a2a4-ac72891c3257	Temporal mean, Global ocean field on model levels [XY-O] [tmean]					AerChemMIP,CMIP,GeoMIP,LUMIP,OMIP,VIACSAB	OMIP	All			
Oyr	3	Net Primary Organic Carbon Production by Diatoms	mol m-3 s-1	Primary (organic carbon) production by the diatom component alone	Primary (organic carbon) production by diatom phytoplankton components alone	ppdiat	tendency_of_mole_concentration_of_particulate_organic_matter_expressed_as_carbon_in_sea_water_due_to_net_primary_production_by_diatoms	area: mean where sea time: mean		real	longitude latitude olevel time	ppdiat	ocnBgchem	yr	area: areacello volume: volcello	Oyr ((isd.003))		76	ba9eced2-e5dd-11e5-8482-ac72891c3257	e525bed4-dd83-11e5-9194-ac72891c3257	f7e4000e-562c-11e6-a2a4-ac72891c3257	Temporal mean, Global ocean field on model levels [XY-O] [tmean]					AerChemMIP,CMIP,GeoMIP,LUMIP,OMIP,VIACSAB	OMIP	All			
Oyr	3	Net Primary Mole Productivity of Carbon by Diazotrophs	mol m-3 s-1	Primary (organic carbon) production by the diazotrophic phytoplankton component alone	Primary (organic carbon) production by diazotroph components alone	ppdiaz	tendency_of_mole_concentration_of_particulate_organic_matter_expressed_as_carbon_in_sea_water_due_to_net_primary_production_by_diazotrophs	area: mean where sea time: mean		real	longitude latitude olevel time	ppdiaz	ocnBgchem	yr	area: areacello volume: volcello	Oyr ((isd.003))		77	ba9ed300-e5dd-11e5-8482-ac72891c3257	e52644bc-dd83-11e5-9194-ac72891c3257	f7e4000e-562c-11e6-a2a4-ac72891c3257	Temporal mean, Global ocean field on model levels [XY-O] [tmean]					AerChemMIP,CMIP,GeoMIP,LUMIP,OMIP	OMIP	All			
Oyr	3	Net Primary Mole Productivity of Carbon by Calcareous Phytoplankton	mol m-3 s-1	Primary (organic carbon) production by the calcite-producing phytoplankton component alone	Primary (organic carbon) production by calcareous phytoplankton components alone	ppcalc	tendency_of_mole_concentration_of_particulate_organic_matter_expressed_as_carbon_in_sea_water_due_to_net_primary_production_by_calcareous_phytoplankton	area: mean where sea time: mean		real	longitude latitude olevel time	ppcalc	ocnBgchem	yr	area: areacello volume: volcello	Oyr ((isd.003))		78	ba9ed724-e5dd-11e5-8482-ac72891c3257	e526caea-dd83-11e5-9194-ac72891c3257	f7e4000e-562c-11e6-a2a4-ac72891c3257	Temporal mean, Global ocean field on model levels [XY-O] [tmean]					AerChemMIP,CMIP,GeoMIP,LUMIP,OMIP	OMIP	All			
Oyr	3	Net Primary Mole Productivity of Carbon by Picophytoplankton	mol m-3 s-1	Primary (organic carbon) production by the picophytoplankton (<2 um) component alone	Primary (organic carbon) production by picophytoplankton components alone	pppico	tendency_of_mole_concentration_of_particulate_organic_matter_expressed_as_carbon_in_sea_water_due_to_net_primary_production_by_picophytoplankton	area: mean where sea time: mean		real	longitude latitude olevel time	pppico	ocnBgchem	yr	area: areacello volume: volcello	Oyr ((isd.003))		79	ba9edb84-e5dd-11e5-8482-ac72891c3257	e527532a-dd83-11e5-9194-ac72891c3257	f7e4000e-562c-11e6-a2a4-ac72891c3257	Temporal mean, Global ocean field on model levels [XY-O] [tmean]					AerChemMIP,CMIP,GeoMIP,LUMIP,OMIP	OMIP	All			
Oyr	3	Net Primary Organic Carbon Production by Other Phytoplankton	mol m-3 s-1	Primary (organic carbon) production by other phytoplankton components alone		ppmisc	tendency_of_mole_concentration_of_particulate_organic_matter_expressed_as_carbon_in_sea_water_due_to_net_primary_production_by_miscellaneous_phytoplankton	area: mean where sea time: mean		real	longitude latitude olevel time	ppmisc	ocnBgchem	yr	area: areacello volume: volcello	Oyr ((isd.003))		80	ba9ee3a4-e5dd-11e5-8482-ac72891c3257	e5278b06-dd83-11e5-9194-ac72891c3257	f7e4000e-562c-11e6-a2a4-ac72891c3257	Temporal mean, Global ocean field on model levels [XY-O] [tmean]					AerChemMIP,CMIP,GeoMIP,LUMIP,OMIP,VIACSAB	OMIP	All			
Oyr	3	Rate of Change of Dissolved Inorganic Carbon Due to Biological Activity	mol m-3 s-1	Net total of biological terms in time rate of change of dissolved inorganic carbon	Net of biological terms in time rate of change of dissolved inorganic carbon	bddtdic	tendency_of_mole_concentration_of_dissolved_inorganic_carbon_in_sea_water_due_to_biological_processes	area: mean where sea time: mean		real	longitude latitude olevel time	bddtdic	ocnBgchem	yr	area: areacello volume: volcello	Oyr ((isd.003))		81	ba9ee7c8-e5dd-11e5-8482-ac72891c3257	1df32c1e9440e03187aa8253e1a0f2d9	f7e4000e-562c-11e6-a2a4-ac72891c3257	Temporal mean, Global ocean field on model levels [XY-O] [tmean]					AerChemMIP,CMIP,GeoMIP,LUMIP,OMIP,VIACSAB	OMIP	All			
Oyr	3	Rate of Change of Nitrogen Nutrient Due to Biological Activity	mol m-3 s-1	Net total of biological terms in time rate of change of nitrogen nutrients (e.g. NO3+NH4)	Net of biological terms in time rate of change of nitrogen nutrients (e.g. NO3+NH4)	bddtdin	tendency_of_mole_concentration_of_dissolved_inorganic_nitrogen_in_sea_water_due_to_biological_processes	area: mean where sea time: mean		real	longitude latitude olevel time	bddtdin	ocnBgchem	yr	area: areacello volume: volcello	Oyr ((isd.003))		82	ba9eebf6-e5dd-11e5-8482-ac72891c3257	c075ee7167ef3bc43fef7ce624f960af	f7e4000e-562c-11e6-a2a4-ac72891c3257	Temporal mean, Global ocean field on model levels [XY-O] [tmean]					AerChemMIP,CMIP,GeoMIP,LUMIP,OMIP,VIACSAB	OMIP	All			
