Notes		Notes on tables
Omon	3	Downward Flux of Particulate Silicon	mol m-2 s-1	In accordance with common usage in geophysical disciplines, 'flux' implies per unit area, called 'flux density' in physics.   'Sinking' is the gravitational settling of particulate matter suspended in a liquid. A sinking flux is positive downwards and is calculated relative to the movement of the surrounding fluid.		epsi100	sinking_mole_flux_of_particulate_silicon_in_sea_water	area: mean where sea time: mean		real	longitude latitude time depth100m	epsi100	ocnBgchem	mon	area: areacello	Omon ((isd.003))	Omon_oth	144	5a35f1ba-c77d-11e6-8a33-5404a60d96b5	f0260f7e851aaf39ac2349b365db89b5	f948813c-80ba-11e6-ab6e-5404a60d96b5	Temporal mean, Global field (single level) [XY-na] {:depth100m} [amse-tmn]					AerChemMIP,C4MIP,CMIP,DCPP,GMMIP,GeoMIP,HighResMIP,LS3MIP,OMIP,PAMIP,VIACSAB,VolMIP	OMIP	All			
Omon	1	Downward Flux of Calcite	mol m-2 s-1	The phrase 'expressed_as' is used in the construction A_expressed_as_B, where B is a chemical constituent of A. It means that the quantity indicated by the standard name is calculated solely with respect to the B contained in A, neglecting all other chemical constituents of A. In accordance with common usage in geophysical disciplines, 'flux' implies per unit area, called 'flux density' in physics.   'Sinking' is the gravitational settling of particulate matter suspended in a liquid. A sinking flux is positive downwards and is calculated relative to the movement of the surrounding fluid. Calcite is a mineral that is a polymorph of calcium carbonate. The chemical formula of calcite is CaCO3. Standard names also exist for aragonite, another polymorph of calcium carbonate.		epcalc100	sinking_mole_flux_of_calcite_expressed_as_carbon_in_sea_water	area: mean where sea time: mean		real	longitude latitude time depth100m	epcalc100	ocnBgchem	mon	area: areacello	Omon ((isd.003))	Omon_oth	145	5a3602cc-c77d-11e6-8a33-5404a60d96b5	6308b546e0eb4e1962d36ba5b98904ee	f948813c-80ba-11e6-ab6e-5404a60d96b5	Temporal mean, Global field (single level) [XY-na] {:depth100m} [amse-tmn]					AerChemMIP,C4MIP,CMIP,DAMIP,DCPP,GMMIP,GeoMIP,HighResMIP,LS3MIP,OMIP,PAMIP,VIACSAB,VolMIP	OMIP	All			
Omon	1	Downward Flux of Aragonite	mol m-2 s-1	The phrase 'expressed_as' is used in the construction A_expressed_as_B, where B is a chemical constituent of A. It means that the quantity indicated by the standard name is calculated solely with respect to the B contained in A, neglecting all other chemical constituents of A. In accordance with common usage in geophysical disciplines, 'flux' implies per unit area, called 'flux density' in physics.   'Sinking' is the gravitational settling of particulate matter suspended in a liquid. A sinking flux is positive downwards and is calculated relative to the movement of the surrounding fluid. Aragonite is a mineral that is a polymorph of calcium carbonate. The chemical formula of aragonite is CaCO3. Standard names also exist for calcite, another polymorph of calcium carbonate.		eparag100	sinking_mole_flux_of_aragonite_expressed_as_carbon_in_sea_water	area: mean where sea time: mean		real	longitude latitude time depth100m	eparag100	ocnBgchem	mon	area: areacello	Omon ((isd.003))	Omon_oth	146	5a361136-c77d-11e6-8a33-5404a60d96b5	f43d7527cd48c992f075339b2bbbf9ef	f948813c-80ba-11e6-ab6e-5404a60d96b5	Temporal mean, Global field (single level) [XY-na] {:depth100m} [amse-tmn]					AerChemMIP,C4MIP,CMIP,DAMIP,GMMIP,GeoMIP,HighResMIP,LS3MIP,OMIP,VIACSAB	OMIP	All			
Omon	2	Dissolved Inorganic Carbon Content	kg m-2	Vertically integrated DIC		intdic	ocean_mass_content_of_dissolved_inorganic_carbon	area: mean where sea depth: sum where sea time: mean		real	longitude latitude time	intdic	ocnBgchem	mon	area: areacello	Omon ((isd.003))	Omon_oth	147	c91e4b7c-c5e8-11e6-84e6-5404a60d96b5	5fc649c5cc7f4737f3a81d1c6b151b26	63c064e0-15f2-11e7-87e0-5404a60d96b5	Temporal mean, Global field (sum over depth) [XY-na] [amdss-tmn]					AerChemMIP,C4MIP,CMIP,GMMIP,GeoMIP,HighResMIP,LS3MIP,OMIP,VIACSAB	OMIP	All			
Omon	2	Dissolved Organic Carbon Content	kg m-2	Vertically integrated DOC (explicit pools only)		intdoc	ocean_mass_content_of_dissolved_organic_carbon	area: mean where sea depth: sum where sea time: mean		real	longitude latitude time	intdoc	ocnBgchem	mon	area: areacello	Omon ((isd.003))	Omon_oth	148	c91e58f6-c5e8-11e6-84e6-5404a60d96b5	a1bd45ea349a310ceaec3f0c417f8aa5	63c064e0-15f2-11e7-87e0-5404a60d96b5	Temporal mean, Global field (sum over depth) [XY-na] [amdss-tmn]					AerChemMIP,C4MIP,CMIP,GMMIP,GeoMIP,HighResMIP,LS3MIP,OMIP	OMIP	All			
Omon	2	Particulate Organic Carbon Content	kg m-2	Vertically integrated POC		intpoc	ocean_mass_content_of_particulate_organic_matter_expressed_as_carbon	area: mean where sea depth: sum where sea time: mean		real	longitude latitude time	intpoc	ocnBgchem	mon	area: areacello	Omon ((isd.003))	Omon_oth	149	baa0c37c-e5dd-11e5-8482-ac72891c3257	ede7b0fb492e75c5fb9139996880695a	63c064e0-15f2-11e7-87e0-5404a60d96b5	Temporal mean, Global field (sum over depth) [XY-na] [amdss-tmn]					AerChemMIP,C4MIP,CMIP,GMMIP,GeoMIP,HighResMIP,LS3MIP,OMIP	OMIP	All			
Omon	1	Surface Aqueous Partial Pressure of CO2	Pa	The surface called 'surface' means the lower boundary of the atmosphere. The partial pressure of a dissolved gas in sea water is the partial pressure in air with which it would be in equilibrium. The partial pressure of a gaseous constituent of air is the pressure which it alone would exert with unchanged temperature and number of moles per unit volume. The chemical formula for carbon dioxide is CO2.		spco2	surface_partial_pressure_of_carbon_dioxide_in_sea_water	area: mean where sea time: mean		real	longitude latitude time depth0m	spco2	ocnBgchem	mon	area: areacello	Omon ((isd.003))	Omon_oth	150	baa0c7a0-e5dd-11e5-8482-ac72891c3257	88d79ec028b6e797cd2db6f00f9b6910	f9495c2e-80ba-11e6-ab6e-5404a60d96b5	Temporal mean, Global field (single level) [XY-na] {:depth0m} [amse-tmn]					AerChemMIP,C4MIP,CMIP,DAMIP,DCPP,GMMIP,GeoMIP,HighResMIP,LS3MIP,OMIP,PAMIP,VIACSAB	CMIP,OMIP	All			
Omon	1	Natural Surface Aqueous Partial Pressure of CO2	Pa	The surface called 'surface' means the lower boundary of the atmosphere. The chemical formula for carbon dioxide is CO2. In ocean biogeochemistry models, a 'natural analogue' is used to simulate the effect on a modelled variable of imposing preindustrial atmospheric carbon dioxide concentrations, even when the model as a whole may be subjected to varying forcings. The partial pressure of a gaseous constituent of air is the pressure which it alone would exert with unchanged temperature and number of moles per unit volume. The partial pressure of a dissolved gas in sea water is the partial pressure in air with which it would be in equilibrium. The partial pressure difference between sea water and air is positive when the partial pressure of the dissolved gas in sea water is greater than the partial pressure in air.		spco2nat	surface_carbon_dioxide_natural_analogue_partial_pressure_difference_between_sea_water_and_air	area: mean where sea time: mean		real	longitude latitude time depth0m	spco2nat	ocnBgchem	mon	area: areacello	Omon ((isd.003))	Omon_oth	151	c91e799e-c5e8-11e6-84e6-5404a60d96b5	c972f264-c5f0-11e6-ac20-5404a60d96b5	f9495c2e-80ba-11e6-ab6e-5404a60d96b5	Temporal mean, Global field (single level) [XY-na] {:depth0m} [amse-tmn]					AerChemMIP,C4MIP,CMIP,GMMIP,GeoMIP,HighResMIP,LS3MIP,OMIP	OMIP	All			
Omon	1	Abiotic Surface Aqueous Partial Pressure of CO2	Pa	The surface called 'surface' means the lower boundary of the atmosphere. The chemical formula for carbon dioxide is CO2. In ocean biogeochemistry models, an 'abiotic analogue' is used to simulate the effect on a modelled variable when biological effects on ocean carbon concentration and alkalinity are ignored. The partial pressure of a gaseous constituent of air is the pressure which it alone would exert with unchanged temperature and number of moles per unit volume. The partial pressure of a dissolved gas in sea water is the partial pressure in air with which it would be in equilibrium. The partial pressure difference between sea water and air is positive when the partial pressure of the dissolved gas in sea water is greater than the partial pressure in air.		spco2abio	surface_carbon_dioxide_abiotic_analogue_partial_pressure_difference_between_sea_water_and_air	area: mean where sea time: mean		real	longitude latitude time depth0m	spco2abio	ocnBgchem	mon	area: areacello	Omon ((isd.003))	Omon_oth	152	c91e8768-c5e8-11e6-84e6-5404a60d96b5	c972ffd4-c5f0-11e6-ac20-5404a60d96b5	f9495c2e-80ba-11e6-ab6e-5404a60d96b5	Temporal mean, Global field (single level) [XY-na] {:depth0m} [amse-tmn]					AerChemMIP,C4MIP,CMIP,GMMIP,GeoMIP,HighResMIP,LS3MIP,OMIP	OMIP	All			
Omon	3	Delta CO2 Partial Pressure	Pa	Difference in partial pressure of carbon dioxide between sea water and air.  The partial pressure of a dissolved gas in sea water is the partial pressure in air with which it would be in equilibrium. 		dpco2	surface_carbon_dioxide_partial_pressure_difference_between_sea_water_and_air	area: mean where sea time: mean		real	longitude latitude time depth0m	dpco2	ocnBgchem	mon	area: areacello	Omon ((isd.003))	Omon_oth	153	baa0cbc4-e5dd-11e5-8482-ac72891c3257	011e37046b327b256ca0e6b5f8722699	f9495c2e-80ba-11e6-ab6e-5404a60d96b5	Temporal mean, Global field (single level) [XY-na] {:depth0m} [amse-tmn]					AerChemMIP,C4MIP,CDRMIP,CMIP,GMMIP,GeoMIP,HighResMIP,LS3MIP,LUMIP,OMIP,VolMIP	OMIP	All			
Omon	3	Natural Delta CO2 Partial Pressure 	Pa	Difference in partial pressure of natural-analogue carbon dioxide between sea water and air.  The partial pressure of a dissolved gas in sea water is the partial pressure in air with which it would be in equilibrium.  A natural analogue is used to simulate the effect on a modelled variable of imposing preindustrial atmospheric carbon dioxide concentrations, even when the model as a whole may be subjected to varying forcings. 		dpco2nat	surface_carbon_dioxide_natural_analogue_partial_pressure_difference_between_sea_water_and_air	area: mean where sea time: mean		real	longitude latitude time depth0m	dpco2nat	ocnBgchem	mon	area: areacello	Omon ((isd.003))	Omon_oth	154	c91e9f50-c5e8-11e6-84e6-5404a60d96b5	c97316d6-c5f0-11e6-ac20-5404a60d96b5	f9495c2e-80ba-11e6-ab6e-5404a60d96b5	Temporal mean, Global field (single level) [XY-na] {:depth0m} [amse-tmn]					AerChemMIP,C4MIP,CMIP,GMMIP,GeoMIP,HighResMIP,LS3MIP,OMIP	OMIP	All			
Omon	3	Abiotic Delta Pco Partial Pressure	Pa	Difference in partial pressure of abiotic-analogue carbon dioxide between sea water and air.  The partial pressure of a dissolved gas in sea water is the partial pressure in air with which it would be in equilibrium. An abiotic analogue is used to simulate the effect on a modelled variable when biological effects on ocean carbon concentration and alkalinity are ignored.		dpco2abio	surface_carbon_dioxide_abiotic_analogue_partial_pressure_difference_between_sea_water_and_air	area: mean where sea time: mean		real	longitude latitude time depth0m	dpco2abio	ocnBgchem	mon	area: areacello	Omon ((isd.003))	Omon_oth	155	c91eacfc-c5e8-11e6-84e6-5404a60d96b5	c97324c8-c5f0-11e6-ac20-5404a60d96b5	f9495c2e-80ba-11e6-ab6e-5404a60d96b5	Temporal mean, Global field (single level) [XY-na] {:depth0m} [amse-tmn]					AerChemMIP,C4MIP,CMIP,GMMIP,GeoMIP,HighResMIP,LS3MIP,OMIP	OMIP	All			
Omon	3	Delta O2 Partial Pressure	Pa	The partial pressure of a dissolved gas in sea water is the partial pressure in air with which it would be in equilibrium.  The partial pressure of a gaseous constituent of air is the pressure which it alone would exert with unchanged temperature and number of moles per unit volume.  The surface called 'surface' means the lower boundary of the atmosphere.		dpo2	surface_molecular_oxygen_partial_pressure_difference_between_sea_water_and_air	area: mean where sea time: mean		real	longitude latitude time depth0m	dpo2	ocnBgchem	mon	area: areacello	Omon ((isd.003))	Omon_oth	156	baa0cff2-e5dd-11e5-8482-ac72891c3257	abe5993d07b8b52e770ed957b060f9ed	f9495c2e-80ba-11e6-ab6e-5404a60d96b5	Temporal mean, Global field (single level) [XY-na] {:depth0m} [amse-tmn]					AerChemMIP,C4MIP,CMIP,GMMIP,GeoMIP,HighResMIP,LS3MIP,OMIP	OMIP	All			
Omon	1	Surface Downward Mass Flux of Carbon as CO2 [kgC m-2 s-1]	kg m-2 s-1	Gas exchange flux of CO2 (positive into ocean)		fgco2	surface_downward_mass_flux_of_carbon_dioxide_expressed_as_carbon	area: mean where sea time: mean	down	real	longitude latitude time depth0m	fgco2	ocnBgchem	mon	area: areacello	Omon ((isd.003))	Omon_oth	157	baa0d420-e5dd-11e5-8482-ac72891c3257	f64c4ac230024801b1f140d806a00972	f9495c2e-80ba-11e6-ab6e-5404a60d96b5	Temporal mean, Global field (single level) [XY-na] {:depth0m} [amse-tmn]					AerChemMIP,C4MIP,CDRMIP,CMIP,DAMIP,DCPP,GMMIP,GeoMIP,HighResMIP,LS3MIP,LUMIP,OMIP,PAMIP,VIACSAB,VolMIP	CMIP,OMIP	All			
Omon	1	Surface Downward Mass Flux of Carbon as Natural CO2 [kgC m-2 s-1]	kg m-2 s-1	Gas exchange flux of natural CO2 (positive into ocean)		fgco2nat	surface_downward_mass_flux_of_carbon_dioxide_natural_analogue_expressed_as_carbon	area: mean where sea time: mean	down	real	longitude latitude time depth0m	fgco2nat	ocnBgchem	mon	area: areacello	Omon ((isd.003))	Omon_oth	158	baa0d844-e5dd-11e5-8482-ac72891c3257	97c037c3357f24c4e06c07123224b400	f9495c2e-80ba-11e6-ab6e-5404a60d96b5	Temporal mean, Global field (single level) [XY-na] {:depth0m} [amse-tmn]					AerChemMIP,C4MIP,CMIP,GMMIP,GeoMIP,HighResMIP,LS3MIP,OMIP	OMIP	All			
Omon	1	Surface Downward Mass Flux of Carbon as Abiotic CO2 [kgC m-2 s-1]	kg m-2 s-1	Gas exchange flux of abiotic CO2 (positive into ocean)		fgco2abio	surface_downward_mass_flux_of_carbon_dioxide_abiotic_analogue_expressed_as_carbon	area: mean where sea time: mean	down	real	longitude latitude time depth0m	fgco2abio	ocnBgchem	mon	area: areacello	Omon ((isd.003))	Omon_oth	159	baa0dc68-e5dd-11e5-8482-ac72891c3257	042e575e61a271e122d317ca7b39dcb4	f9495c2e-80ba-11e6-ab6e-5404a60d96b5	Temporal mean, Global field (single level) [XY-na] {:depth0m} [amse-tmn]					AerChemMIP,C4MIP,CMIP,GMMIP,GeoMIP,HighResMIP,LS3MIP,OMIP	OMIP	All			
Omon	1	Surface Downward Mass Flux of Carbon-14 as Abiotic 14CO2 [kgC m-2 s-1]	kg m-2 s-1	Gas exchange flux of abiotic 14CO2 (positive into ocean)		fg14co2abio	surface_downward_mass_flux_of_14C_dioxide_abiotic_analogue_expressed_as_carbon	area: mean where sea time: mean	down	real	longitude latitude time depth0m	fg14co2abio	ocnBgchem	mon	area: areacello	Omon ((isd.003))	Omon_oth	160	baa0e08c-e5dd-11e5-8482-ac72891c3257	f36046ab9a8a24ce4d7431e2defd9cf6	f9495c2e-80ba-11e6-ab6e-5404a60d96b5	Temporal mean, Global field (single level) [XY-na] {:depth0m} [amse-tmn]					AerChemMIP,C4MIP,CMIP,GMMIP,GeoMIP,HighResMIP,LS3MIP,OMIP	OMIP	All			
Omon	1	Surface Downward Mass Flux of Carbon-13 as 13CO2 [kgC m-2 s-1]	kg m-2 s-1	Gas exchange flux of carbon-13 as CO2 (positive into ocean)	Gas exchange flux of abiotic 13CO2 (positive into ocean)	fg13co2	surface_downward_mass_flux_of_13C_dioxide_abiotic_analogue_expressed_as_13C	area: mean where sea time: mean	down	real	longitude latitude time depth0m	fg13co2	ocnBgchem	mon	area: areacello	Omon ((isd.003))	Omon_oth	161	804534f0-f906-11e6-a176-5404a60d96b5	590e5b82-9e49-11e5-803c-0d0b866b59f3	f9495c2e-80ba-11e6-ab6e-5404a60d96b5	Temporal mean, Global field (single level) [XY-na] {:depth0m} [amse-tmn]					AerChemMIP,C4MIP,CMIP,GMMIP,GeoMIP,HighResMIP,LS3MIP,LUMIP,OMIP,PMIP	OMIP	All			
Omon	1	Surface Downward Flux of O2	mol m-2 s-1	Gas exchange flux of O2 (positive into ocean)		fgo2	surface_downward_mole_flux_of_molecular_oxygen	area: mean where sea time: mean	down	real	longitude latitude time depth0m	fgo2	ocnBgchem	mon	area: areacello	Omon ((isd.003))	Omon_oth	162	baa0e4ba-e5dd-11e5-8482-ac72891c3257	02e40424bc4b63c1ae535165def98421	f9495c2e-80ba-11e6-ab6e-5404a60d96b5	Temporal mean, Global field (single level) [XY-na] {:depth0m} [amse-tmn]					AerChemMIP,C4MIP,CMIP,DAMIP,GMMIP,GeoMIP,HighResMIP,LS3MIP,OMIP,VIACSAB,VolMIP	OMIP	All			
Omon	3	Surface Upward Flux of DMS	mol m-2 s-1	Gas exchange flux of DMS (positive into atmosphere)		fgdms	surface_upward_mole_flux_of_dimethyl_sulfide	area: mean where sea time: mean	up	real	longitude latitude time depth0m	fgdms	ocnBgchem	mon	area: areacello	Omon ((isd.003))	Omon_oth	163	baa0e906-e5dd-11e5-8482-ac72891c3257	190f38cb06f9a1f3133c3dcf66e0421e	f9495c2e-80ba-11e6-ab6e-5404a60d96b5	Temporal mean, Global field (single level) [XY-na] {:depth0m} [amse-tmn]					AerChemMIP,C4MIP,CMIP,GMMIP,GeoMIP,HighResMIP,LS3MIP,OMIP,VIACSAB	OMIP	All			
Omon	3	Flux of Inorganic Carbon into Ocean Surface by Runoff	mol m-2 s-1	Inorganic Carbon supply to ocean through runoff (separate from gas exchange)		icfriver	tendency_of_ocean_mole_content_of_inorganic_carbon_due_to_runoff_and_sediment_dissolution	area: mean where sea time: mean		real	longitude latitude time depth0m	icfriver	ocnBgchem	mon	area: areacello	Omon ((isd.003))	Omon_oth	164	baa0ed2a-e5dd-11e5-8482-ac72891c3257	9c4f9fe04addd510e5fbedd35e01a5db	f9495c2e-80ba-11e6-ab6e-5404a60d96b5	Temporal mean, Global field (single level) [XY-na] {:depth0m} [amse-tmn]					AerChemMIP,C4MIP,CDRMIP,CMIP,GMMIP,GeoMIP,HighResMIP,LS3MIP,OMIP	OMIP	All			
Omon	3	Downward Inorganic Carbon Flux at Ocean Bottom	mol m-2 s-1	Inorganic Carbon loss to sediments		fric	minus_tendency_of_ocean_mole_content_of_inorganic_carbon_due_to_sedimentation	area: mean where sea time: mean		real	longitude latitude time	fric	ocnBgchem	mon	area: areacello	Omon ((isd.003))	Omon_oth	165	baa0f14e-e5dd-11e5-8482-ac72891c3257	e799552047be54bf13ccbe494c73cc81	e9f9f6ca-c1ce-11e6-8067-ac72891c3257	Temporal mean, Global field (single level) [XY-na] [amse-tmn]					AerChemMIP,C4MIP,CDRMIP,CMIP,GMMIP,GeoMIP,HighResMIP,LS3MIP,OMIP,PMIP	OMIP	All			
Omon	3	Flux of Organic Carbon into Ocean Surface by Runoff	mol m-2 s-1	Organic Carbon supply to ocean through runoff (separate from gas exchange)		ocfriver	tendency_of_ocean_mole_content_of_organic_carbon_due_to_runoff_and_sediment_dissolution	area: mean where sea time: mean		real	longitude latitude time depth0m	ocfriver	ocnBgchem	mon	area: areacello	Omon ((isd.003))	Omon_oth	166	baa0f57c-e5dd-11e5-8482-ac72891c3257	5be0620fea71e2541aa08aac57ed9243	f9495c2e-80ba-11e6-ab6e-5404a60d96b5	Temporal mean, Global field (single level) [XY-na] {:depth0m} [amse-tmn]					AerChemMIP,C4MIP,CDRMIP,CMIP,GMMIP,GeoMIP,HighResMIP,LS3MIP,OMIP	OMIP	All			
Omon	3	Downward Organic Carbon Flux at Ocean Bottom	mol m-2 s-1	Organic Carbon loss to sediments		froc	minus_tendency_of_ocean_mole_content_of_organic_carbon_due_to_sedimentation	area: mean where sea time: mean		real	longitude latitude time	froc	ocnBgchem	mon	area: areacello	Omon ((isd.003))	Omon_oth	167	baa0f9b4-e5dd-11e5-8482-ac72891c3257	5895b847e6247f0058199d1b26772655	e9f9f6ca-c1ce-11e6-8067-ac72891c3257	Temporal mean, Global field (single level) [XY-na] [amse-tmn]					AerChemMIP,C4MIP,CDRMIP,CMIP,GMMIP,GeoMIP,HighResMIP,LS3MIP,OMIP,PMIP,VolMIP	OMIP	All			
Omon	3	Nitrogen Fixation Rate in Ocean	mol m-2 s-1	Vertically integrated nitrogen fixation		intpn2	tendency_of_ocean_mole_content_of_elemental_nitrogen_due_to_fixation	area: mean where sea depth: sum where sea time: mean		real	longitude latitude time	intpn2	ocnBgchem	mon	area: areacello	Omon ((isd.003))	Omon_oth	168	baa0fe00-e5dd-11e5-8482-ac72891c3257	6c2e81334ca2f0de1813f46d64ee1924	63c064e0-15f2-11e7-87e0-5404a60d96b5	Temporal mean, Global field (sum over depth) [XY-na] [amdss-tmn]					AerChemMIP,C4MIP,CDRMIP,CMIP,GMMIP,GeoMIP,HighResMIP,LS3MIP,OMIP,VIACSAB	OMIP	All			
Omon	3	Surface Downward Net Flux of Nitrogen	mol m-2 s-1	Flux of nitrogen into the ocean due to deposition (sum of dry and wet deposition), fixation (the production of ammonia from nitrogen gas by diazotrophs) and runoff (liquid water which drains from land).		fsn	tendency_of_ocean_mole_content_of_elemental_nitrogen_due_to_deposition_and_fixation_and_runoff	area: mean where sea time: mean		real	longitude latitude time depth0m	fsn	ocnBgchem	mon	area: areacello	Omon ((isd.003))	Omon_oth	169	baa10292-e5dd-11e5-8482-ac72891c3257	96b53e6411f945d703ee5d081faee987	f9495c2e-80ba-11e6-ab6e-5404a60d96b5	Temporal mean, Global field (single level) [XY-na] {:depth0m} [amse-tmn]					AerChemMIP,C4MIP,CMIP,GMMIP,GeoMIP,HighResMIP,LS3MIP,OMIP,VIACSAB	OMIP	All			
Omon	3	Nitrogen Loss to Sediments and Through Denitrification	mol m-2 s-1	'Content' indicates a quantity per unit area.  The specification of a physical process by the phrase due_to_process means that the quantity named is a single term in a sum of terms which together compose the general quantity  named by omitting the phrase. 'Denitrification' is the conversion of nitrate into gaseous compounds such as nitric oxide, nitrous oxide and molecular nitrogen which are then emitted to the atmosphere.  'Sedimentation' is the sinking of particulate matter to the floor of a body of water. 'tendency_of_X' means derivative of X with respect to time.		frn	minus_tendency_of_ocean_mole_content_of_elemental_nitrogen_due_to_denitrification_and_sedimentation	area: mean where sea time: mean		real	longitude latitude time	frn	ocnBgchem	mon	area: areacello	Omon ((isd.003))	Omon_oth	170	baa106c0-e5dd-11e5-8482-ac72891c3257	c73793c9a403918cf29279cbc374d509	e9f9f6ca-c1ce-11e6-8067-ac72891c3257	Temporal mean, Global field (single level) [XY-na] [amse-tmn]					AerChemMIP,C4MIP,CMIP,GMMIP,GeoMIP,HighResMIP,LS3MIP,OMIP,VIACSAB	OMIP	All			
Omon	3	Surface Downward Net Flux of Iron	mol m-2 s-1	Iron supply through deposition flux onto sea surface, runoff, coasts, sediments, etc		fsfe	tendency_of_ocean_mole_content_of_iron_due_to_deposition_and_runoff_and_sediment_dissolution	area: mean where sea time: mean		real	longitude latitude time depth0m	fsfe	ocnBgchem	mon	area: areacello	Omon ((isd.003))	Omon_oth	171	baa10aee-e5dd-11e5-8482-ac72891c3257	b385b4f43e7385eb7bfe4e2175bb086d	f9495c2e-80ba-11e6-ab6e-5404a60d96b5	Temporal mean, Global field (single level) [XY-na] {:depth0m} [amse-tmn]					AerChemMIP,C4MIP,CMIP,GMMIP,GeoMIP,HighResMIP,LS3MIP,OMIP,VIACSAB	OMIP	All			
Omon	3	Iron Loss to Sediments	mol m-2 s-1	'Content' indicates a quantity per unit area.  The specification of a physical process by the phrase due_to_process means that the quantity named is a  single term in a sum of terms which together compose the general quantity  named by omitting the phrase.  'tendency_of_X' means derivative of X with respect to time.		frfe	minus_tendency_of_ocean_mole_content_of_iron_due_to_sedimentation	area: mean where sea time: mean		real	longitude latitude time	frfe	ocnBgchem	mon	area: areacello	Omon ((isd.003))	Omon_oth	172	baa10f12-e5dd-11e5-8482-ac72891c3257	ae3a674b4f541f95d2b05da4a84507e7	e9f9f6ca-c1ce-11e6-8067-ac72891c3257	Temporal mean, Global field (single level) [XY-na] [amse-tmn]					AerChemMIP,C4MIP,CMIP,GMMIP,GeoMIP,HighResMIP,LS3MIP,OMIP,VIACSAB	OMIP	All			
Omon	3	Oxygen Minimum Concentration	mol m-3	'Mole concentration' means number of moles per unit volume, also called 'molarity', and is used in the construction mole_concentration_of_X_in_Y, where X is a material constituent of Y.  A chemical or biological species denoted by X may be described by a single term such as 'nitrogen' or a phrase such as 'nox_expressed_as_nitrogen'. The concentration of any chemical species, whether particulate or dissolved, may vary with depth in the ocean.  A depth profile may go through one or more local minima in concentration. The mole_concentration_of_molecular_oxygen_in_sea_water_at_shallowest_local_minimum_in_vertical_profile is the mole concentration of oxygen at the local minimum in the concentration profile that occurs closest to the sea surface.		o2min	mole_concentration_of_dissolved_molecular_oxygen_in_sea_water_at_shallowest_local_minimum_in_vertical_profile	area: mean where sea time: mean		real	longitude latitude time	o2min	ocnBgchem	mon	area: areacello	Omon ((isd.003))	Omon_oth	173	baa11336-e5dd-11e5-8482-ac72891c3257	01f509c26cfbd2f30789d91b026e0016	e9f9f6ca-c1ce-11e6-8067-ac72891c3257	Temporal mean, Global field (single level) [XY-na] [amse-tmn]					AerChemMIP,C4MIP,CMIP,GMMIP,GeoMIP,HighResMIP,LS3MIP,OMIP,VIACSAB,VolMIP	OMIP	All			
Omon	3	Depth of Oxygen Minimum Concentration	m	Depth of vertical minimum concentration of dissolved oxygen gas (if two, then the shallower)		zo2min	depth_at_shallowest_local_minimum_in_vertical_profile_of_mole_concentration_of_dissolved_molecular_oxygen_in_sea_water	area: mean where sea time: mean		real	longitude latitude time	zo2min	ocnBgchem	mon	area: areacello	Omon ((isd.003))	Omon_oth	174	baa11764-e5dd-11e5-8482-ac72891c3257	d254e68c03491d17660ec44e7565f9e2	e9f9f6ca-c1ce-11e6-8067-ac72891c3257	Temporal mean, Global field (single level) [XY-na] [amse-tmn]					AerChemMIP,C4MIP,CMIP,GMMIP,GeoMIP,HighResMIP,LS3MIP,OMIP,VIACSAB	OMIP	All			
Omon	3	Calcite Saturation Depth	m	Depth of calcite saturation horizon (0 if undersaturated at all depths, and missing saturated through whole depth; if two or more horizons exist, then the shallowest is reported)	Depth of calcite saturation horizon (0 if < surface, 'missing' if > bottom, if two, then the shallower)	zsatcalc	minimum_depth_of_calcite_undersaturation_in_sea_water	area: mean where sea time: mean		real	longitude latitude time	zsatcalc	ocnBgchem	mon	area: areacello	Omon ((isd.003))	Omon_oth	175	baa11b92-e5dd-11e5-8482-ac72891c3257	7324bbd4b756759ef380f305fe5856b2	e9f9f6ca-c1ce-11e6-8067-ac72891c3257	Temporal mean, Global field (single level) [XY-na] [amse-tmn]					AerChemMIP,C4MIP,CDRMIP,CMIP,GMMIP,GeoMIP,HighResMIP,LS3MIP,OMIP,VIACSAB	OMIP	All			
