Notes		Notes on tables
Notes	Request Version	01.00.31beta
Notes	MIPs (...)	The last two columns in each row list MIPs associated with each variable. The first column in this pair lists the MIPs which are requesting the variable in one or more experiments. The second column lists the MIPs proposing experiments in which this variable is requested. E.g. If a variable is requested in a DECK experiment by HighResMIP, then HighResMIP appears in the first column and DECK in the second
Notes	Table	Reference Volume (1 deg. atmosphere, 0.5 deg. ocean)
Notes	Amon	99G
Notes	Efx	0M
Notes	Emon	10G
Notes	Eyr	802M
Notes	LImon	1G
Notes	Lmon	9G
Notes	Oday	83G
Notes	Ofx	208M
Notes	Omon	8.8T
Notes	Oyr	1.0T
Notes	SIday	125G
Notes	SImon	44G
Notes	day	83G
Notes	fx	17M
MIP table	Priority	Long name	units	description	comment	Variable Name	CF Standard Name	cell_methods	positive	type	dimensions	CMOR Name	modeling_realm	frequency	cell_measures	prov	provNote	rowIndex	UID	vid	stid	Structure Title	valid_min	valid_max	ok_min_mean_abs	ok_max_mean_abs	MIPs (requesting)	MIPs (by experiment)	Number of Years	Slice Type	Years	Grid	
Amon	Lowest priority value set in request for this variable for this experiment	NetCDF Global Attribute			Name of variable in file			CMOR directive			CMOR name, unique within table										CMOR variable identifier	MIP variable identifier	Structure identifier										
Amon	1	Near-Surface Air Temperature	K	near-surface (usually, 2 meter) air temperature		tas	air_temperature	area: time: mean		real	longitude latitude time height2m	tas	atmos	mon	area: areacella	Amon ((isd.003))	Amon_2d	14	bab9237c-e5dd-11e5-8482-ac72891c3257	5c4978e802ba55d5a298cf1b3bdc2b3a	f7e1ef26-562c-11e6-a2a4-ac72891c3257	Temporal mean, Global field (single level) [XY-na] {:height2m} [tmean]	170.0 r	350.0 r	255.0 r	295.0 r	AerChemMIP,C4MIP,CDRMIP,CFMIP,CMIP,DAMIP,DCPP,DynVarMIP,FAFMIP,GMMIP,GeoMIP,HighResMIP,ISMIP6,LS3MIP,LUMIP,PAMIP,PMIP,RFMIP,VIACSAB,VolMIP	CMIP	All			
Amon	1	Surface Temperature	K	Temperature of the lower boundary of the atmosphere	Surface temperature (skin for open ocean)	ts	surface_temperature	area: time: mean		real	longitude latitude time	ts	atmos	mon	area: areacella	Amon ((isd.003))	Amon_2d	15	babaef0e-e5dd-11e5-8482-ac72891c3257	90c49fce92dc1f21647dad07d1342843	f7dcac96-562c-11e6-a2a4-ac72891c3257	Temporal mean, Global field (single level) [XY-na] [am-tm]	170.0 r	340.0 r	255.0 r	295.0 r	AerChemMIP,C4MIP,CFMIP,CMIP,DAMIP,DCPP,FAFMIP,GMMIP,GeoMIP,HighResMIP,ISMIP6,LS3MIP,LUMIP,PAMIP,PMIP,RFMIP,VIACSAB,VolMIP	CMIP	All			
Amon	1	Daily Minimum Near-Surface Air Temperature	K	minimum near-surface (usually, 2 meter) air temperature (add cell_method attribute 'time: min')	monthly mean of the daily-minimum near-surface air temperature.	tasmin	air_temperature	area: mean time: minimum within days time: mean over days		real	longitude latitude time height2m	tasmin	atmos	mon	area: areacella	Amon ((isd.003))	Amon_2d	16	bab955ea-e5dd-11e5-8482-ac72891c3257	cce3dd39c138bf3c4d713263cc2e6cff	f7e03122-562c-11e6-a2a4-ac72891c3257	Temporal mean, Global field (single level) [XY-na] {:height2m} [dmin]	165.0 r	345.0 r	250.0 r	290.0 r	AerChemMIP,C4MIP,CFMIP,CMIP,DAMIP,DCPP,FAFMIP,GMMIP,GeoMIP,HighResMIP,ISMIP6,LS3MIP,LUMIP,PAMIP,PMIP,RFMIP,VIACSAB,VolMIP	CMIP	All			
Amon	1	Daily Maximum Near-Surface Air Temperature	K	maximum near-surface (usually, 2 meter) air temperature (add cell_method attribute 'time: max')	monthly mean of the daily-maximum near-surface air temperature.	tasmax	air_temperature	area: mean time: maximum within days time: mean over days		real	longitude latitude time height2m	tasmax	atmos	mon	area: areacella	Amon ((isd.003))	Amon_2d	17	bab942a8-e5dd-11e5-8482-ac72891c3257	2dd48e8c50b4b88a83ff07d308e4e642	f7e04194-562c-11e6-a2a4-ac72891c3257	Temporal mean, Global field (single level) [XY-na] {:height2m} [dmax]	175.0 r	355.0 r	260.0 r	300.0 r	AerChemMIP,C4MIP,CFMIP,CMIP,DAMIP,DCPP,FAFMIP,GMMIP,GeoMIP,HighResMIP,ISMIP6,LS3MIP,LUMIP,PAMIP,PMIP,RFMIP,VIACSAB,VolMIP	CMIP	All			
Amon	1	Sea Level Pressure	Pa	Sea Level Pressure	not, in general, the same as surface pressure	psl	air_pressure_at_mean_sea_level	area: time: mean		real	longitude latitude time	psl	atmos	mon	area: areacella	Amon ((isd.003))	Amon_2d	18	bab48ce0-e5dd-11e5-8482-ac72891c3257	3d23c359f44d6a153c4dcab9e07d7cb6	f7dcac96-562c-11e6-a2a4-ac72891c3257	Temporal mean, Global field (single level) [XY-na] [am-tm]	91000.0 r	109000.0 r	96000.0 r	106000.0 r	AerChemMIP,C4MIP,CDRMIP,CFMIP,CMIP,DAMIP,DCPP,DynVarMIP,FAFMIP,GMMIP,GeoMIP,HighResMIP,LS3MIP,LUMIP,PAMIP,PMIP,RFMIP,VIACSAB,VolMIP	CMIP	All			
Amon	1	Surface Air Pressure	Pa	surface pressure (not mean sea-level pressure), 2-D field to calculate the 3-D pressure field from hybrid coordinates	not, in general, the same as mean sea-level pressure	ps	surface_air_pressure	area: time: mean		real	longitude latitude time	ps	atmos	mon	area: areacella	Amon ((isd.003))	Amon_2d	19	bab47b56-e5dd-11e5-8482-ac72891c3257	8c9504d28596e05586c8e193082ac617	f7dcac96-562c-11e6-a2a4-ac72891c3257	Temporal mean, Global field (single level) [XY-na] [am-tm]	47500.0 r	112000.0 r	93000.0 r	100000.0 r	AerChemMIP,C4MIP,CFMIP,CMIP,DAMIP,DCPP,FAFMIP,GMMIP,GeoMIP,HighResMIP,LS3MIP,LUMIP,PAMIP,PMIP,RFMIP,VIACSAB,VolMIP	CMIP	All			
Amon	1	Precipitation	kg m-2 s-1	includes both liquid and solid phases	at surface; includes both liquid and solid phases from all types of clouds (both large-scale and convective)	pr	precipitation_flux	area: time: mean		real	longitude latitude time	pr	atmos	mon	area: areacella	Amon ((isd.003))	Amon_2d	25	bab3cb52-e5dd-11e5-8482-ac72891c3257	62f26742cf240c1b5169a5cd511196b6	f7dcac96-562c-11e6-a2a4-ac72891c3257	Temporal mean, Global field (single level) [XY-na] [am-tm]	-1e-06 r	0.0015 r	1.5e-05 r	4e-05 r	AerChemMIP,C4MIP,CDRMIP,CFMIP,CMIP,DAMIP,DCPP,DynVarMIP,FAFMIP,GMMIP,GeoMIP,HighResMIP,ISMIP6,LS3MIP,LUMIP,PAMIP,PMIP,RFMIP,VIACSAB,VolMIP	CMIP	All			
Amon	1	Snowfall Flux	kg m-2 s-1	At surface; includes precipitation of all forms of water in the solid phase	at surface; includes precipitation of all forms of water in the solid phase	prsn	snowfall_flux	area: time: mean		real	longitude latitude time	prsn	atmos	mon	area: areacella	Amon ((isd.003))	Amon_2d	26	bab42b88-e5dd-11e5-8482-ac72891c3257	051919eddec810e292c883205c944ceb	f7dcac96-562c-11e6-a2a4-ac72891c3257	Temporal mean, Global field (single level) [XY-na] [am-tm]	-1e-06 r	0.0008 r	1e-06 r	8e-06 r	AerChemMIP,C4MIP,CFMIP,CMIP,DAMIP,DCPP,FAFMIP,GMMIP,GeoMIP,HighResMIP,ISMIP6,LS3MIP,LUMIP,PAMIP,PMIP,RFMIP,VIACSAB,VolMIP	CMIP	All			
Amon	1	Evaporation Including Sublimation and Transpiration	kg m-2 s-1	Evaporation at surface (also known as evapotranspiration): flux of water into the atmosphere due to conversion of both liquid and solid phases to vapor (from underlying surface and vegetation)	at surface; flux of water into the atmosphere due to conversion of both liquid and solid phases to vapor (from underlying surface and vegetation)	evspsbl	water_evapotranspiration_flux	area: time: mean		real	longitude latitude time	evspsbl	atmos	mon	area: areacella	Amon ((isd.003))	Amon_2d	28	baad45c0-e5dd-11e5-8482-ac72891c3257	089961a3af4d54d5fb045cf3750e760c	f7dcac96-562c-11e6-a2a4-ac72891c3257	Temporal mean, Global field (single level) [XY-na] [am-tm]					AerChemMIP,C4MIP,CDRMIP,CFMIP,CMIP,DAMIP,DCPP,FAFMIP,GMMIP,GeoMIP,HighResMIP,ISMIP6,LS3MIP,LUMIP,PAMIP,PMIP,RFMIP,VIACSAB,VolMIP	CMIP	All			
Amon	1	Surface Downward Eastward Wind Stress	Pa	Downward eastward wind stress at the surface		tauu	surface_downward_eastward_stress	area: time: mean	down	real	longitude latitude time	tauu	atmos	mon	area: areacella	Amon ((isd.003))	Amon_2d	30	bab96cc4-e5dd-11e5-8482-ac72891c3257	3abb7c5b4c4650e9d17a8439004aebea	f7dcac96-562c-11e6-a2a4-ac72891c3257	Temporal mean, Global field (single level) [XY-na] [am-tm]	-10.0 r	10.0 r	0.01 r	0.2 r	AerChemMIP,C4MIP,CFMIP,CMIP,DAMIP,DCPP,FAFMIP,GMMIP,GeoMIP,HighResMIP,LS3MIP,LUMIP,PAMIP,PMIP,RFMIP,VIACSAB,VolMIP	CMIP	All			
Amon	1	Surface Downward Northward Wind Stress	Pa	Downward northward wind stress at the surface		tauv	surface_downward_northward_stress	area: time: mean	down	real	longitude latitude time	tauv	atmos	mon	area: areacella	Amon ((isd.003))	Amon_2d	31	bab9888a-e5dd-11e5-8482-ac72891c3257	bd10cebbde1593b65e5220911f9a997c	f7dcac96-562c-11e6-a2a4-ac72891c3257	Temporal mean, Global field (single level) [XY-na] [am-tm]	-10.0 r	10.0 r	0.01 r	0.2 r	AerChemMIP,C4MIP,CFMIP,CMIP,DAMIP,DCPP,FAFMIP,GMMIP,GeoMIP,HighResMIP,LS3MIP,LUMIP,PAMIP,PMIP,RFMIP,VIACSAB,VolMIP	CMIP	All			
Amon	1	Surface Upward Latent Heat Flux	W m-2	The surface called 'surface' means the lower boundary of the atmosphere. 'Upward' indicates a vector component which is positive when directed upward (negative downward). The surface latent heat flux is the exchange of heat between the surface and the air on account of evaporation (including sublimation). In accordance with common usage in geophysical disciplines, 'flux' implies per unit area, called 'flux density' in physics.	includes both evaporation and sublimation	hfls	surface_upward_latent_heat_flux	area: time: mean	up	real	longitude latitude time	hfls	atmos	mon	area: areacella	Amon ((isd.003))	Amon_2d	32	baaefe2e-e5dd-11e5-8482-ac72891c3257	95cbf6ac889c8fe7d92e20e8c34960d1	f7dcac96-562c-11e6-a2a4-ac72891c3257	Temporal mean, Global field (single level) [XY-na] [am-tm]	-400.0 r	1800.0 r	30.0 r	110.0 r	AerChemMIP,C4MIP,CDRMIP,CFMIP,CMIP,DAMIP,DCPP,FAFMIP,GMMIP,GeoMIP,HighResMIP,ISMIP6,LS3MIP,LUMIP,PAMIP,PMIP,RFMIP,VIACSAB,VolMIP	CMIP	All			
Amon	1	Surface Upward Sensible Heat Flux	W m-2	The surface sensible heat flux, also called turbulent heat flux, is the exchange of heat between the surface and the air by motion of air.		hfss	surface_upward_sensible_heat_flux	area: time: mean	up	real	longitude latitude time	hfss	atmos	mon	area: areacella	Amon ((isd.003))	Amon_2d	33	baaf86a0-e5dd-11e5-8482-ac72891c3257	a13ed886b17e20cdae8b89b9ff8e4610	f7dcac96-562c-11e6-a2a4-ac72891c3257	Temporal mean, Global field (single level) [XY-na] [am-tm]	-1000.0 r	2000.0 r	5.0 r	60.0 r	AerChemMIP,C4MIP,CDRMIP,CFMIP,CMIP,DAMIP,DCPP,FAFMIP,GMMIP,GeoMIP,HighResMIP,ISMIP6,LS3MIP,LUMIP,PAMIP,PMIP,RFMIP,VIACSAB,VolMIP	CMIP	All			
Amon	1	Surface Downwelling Longwave Radiation	W m-2	The surface called 'surface' means the lower boundary of the atmosphere. 'longwave' means longwave radiation. Downwelling radiation is radiation from above. It does not mean 'net downward'. When thought of as being incident on a surface, a radiative flux is sometimes called 'irradiance'. In addition, it is identical with the quantity measured by a cosine-collector light-meter and sometimes called 'vector irradiance'. In accordance with common usage in geophysical disciplines, 'flux' implies per unit area, called 'flux density' in physics.		rlds	surface_downwelling_longwave_flux_in_air	area: time: mean	down	real	longitude latitude time	rlds	atmos	mon	area: areacella	Amon ((isd.003))	Amon_2d	34	bab52da8-e5dd-11e5-8482-ac72891c3257	70d7d6fc0e9c2f14624a0270bf2b99b9	f7dcac96-562c-11e6-a2a4-ac72891c3257	Temporal mean, Global field (single level) [XY-na] [am-tm]	30.0 r	520.0 r	260.0 r	330.0 r	AerChemMIP,C4MIP,CFMIP,CMIP,DAMIP,DCPP,FAFMIP,GMMIP,GeoMIP,HighResMIP,ISMIP6,LS3MIP,LUMIP,PAMIP,PMIP,RFMIP,VIACSAB,VolMIP	CMIP	All			
Amon	1	Surface Downwelling Shortwave Radiation	W m-2	Surface solar irradiance for UV calculations.		rsds	surface_downwelling_shortwave_flux_in_air	area: time: mean	down	real	longitude latitude time	rsds	atmos	mon	area: areacella	Amon ((isd.003))	Amon_2d	36	bab5e1b2-e5dd-11e5-8482-ac72891c3257	6e7b9f984d3bba15daccaaa18039a85d	f7dcac96-562c-11e6-a2a4-ac72891c3257	Temporal mean, Global field (single level) [XY-na] [am-tm]	-0.1 r	550.0 r	120.0 r	200.0 r	AerChemMIP,C4MIP,CFMIP,CMIP,DAMIP,DCPP,FAFMIP,GMMIP,GeoMIP,HighResMIP,ISMIP6,LS3MIP,LUMIP,PAMIP,PMIP,RFMIP,VIACSAB,VolMIP	CMIP	All			
Amon	1	Surface Downwelling Clear-Sky Shortwave Radiation	W m-2	Surface solar irradiance clear sky for UV calculations		rsdscs	surface_downwelling_shortwave_flux_in_air_assuming_clear_sky	area: time: mean	down	real	longitude latitude time	rsdscs	atmos	mon	area: areacella	Amon ((isd.003))	Amon_2d	38	bab607c8-e5dd-11e5-8482-ac72891c3257	d0a35d5c99a0aa93ad4069cfe83bf748	f7dcac96-562c-11e6-a2a4-ac72891c3257	Temporal mean, Global field (single level) [XY-na] [am-tm]					AerChemMIP,C4MIP,CFMIP,CMIP,DAMIP,FAFMIP,GMMIP,GeoMIP,HighResMIP,ISMIP6,LS3MIP,LUMIP,PMIP,RFMIP,VIACSAB,VolMIP	CMIP	All			
Amon	1	Surface Downwelling Clear-Sky Longwave Radiation	W m-2	Surface downwelling clear-sky longwave radiation		rldscs	surface_downwelling_longwave_flux_in_air_assuming_clear_sky	area: time: mean	down	real	longitude latitude time	rldscs	atmos	mon	area: areacella	Amon ((isd.003))	Amon_2d	40	bab5540e-e5dd-11e5-8482-ac72891c3257	7b2d1e1a3ece1169d8ac61af4b758ed2	f7dcac96-562c-11e6-a2a4-ac72891c3257	Temporal mean, Global field (single level) [XY-na] [am-tm]	25.0 r	550.0 r	220.0 r	310.0 r	AerChemMIP,C4MIP,CFMIP,CMIP,DAMIP,FAFMIP,GMMIP,GeoMIP,HighResMIP,ISMIP6,LS3MIP,LUMIP,PMIP,RFMIP,VIACSAB,VolMIP	CMIP	All			
Amon	1	TOA Outgoing Shortwave Radiation	W m-2	at the top of the atmosphere		rsut	toa_outgoing_shortwave_flux	area: time: mean	up	real	longitude latitude time	rsut	atmos	mon	area: areacella	Amon ((isd.003))	Amon_2d	42	bab68ebe-e5dd-11e5-8482-ac72891c3257	b907fef85d4c9571a9457ee1b259bb8f	f7dcac96-562c-11e6-a2a4-ac72891c3257	Temporal mean, Global field (single level) [XY-na] [am-tm]	-0.1 r	480.0 r	60.0 r	160.0 r	AerChemMIP,C4MIP,CDRMIP,CFMIP,CMIP,DAMIP,DCPP,FAFMIP,GMMIP,GeoMIP,HighResMIP,ISMIP6,LS3MIP,LUMIP,PAMIP,PMIP,RFMIP,VIACSAB,VolMIP	CMIP	All			
Amon	1	TOA Outgoing Longwave Radiation	W m-2	at the top of the atmosphere (to be compared with satellite measurements)		rlut	toa_outgoing_longwave_flux	area: time: mean	up	real	longitude latitude time	rlut	atmos	mon	area: areacella	Amon ((isd.003))	Amon_2d	43	bab5aad0-e5dd-11e5-8482-ac72891c3257	63345d9732c72b97ca395f24ce2d6642	f7dcac96-562c-11e6-a2a4-ac72891c3257	Temporal mean, Global field (single level) [XY-na] [am-tm]	65.0 r	385.0 r	205.0 r	305.0 r	AerChemMIP,C4MIP,CDRMIP,CFMIP,CMIP,DAMIP,DCPP,FAFMIP,GMMIP,GeoMIP,HighResMIP,ISMIP6,LS3MIP,LUMIP,PAMIP,PMIP,RFMIP,VIACSAB,VolMIP	CMIP	All			
Amon	1	TOA Outgoing Clear-Sky Longwave Radiation	W m-2	Upwelling clear-sky longwave radiation at top of atmosphere		rlutcs	toa_outgoing_longwave_flux_assuming_clear_sky	area: time: mean	up	real	longitude latitude time	rlutcs	atmos	mon	area: areacella	Amon ((isd.003))	Amon_2d	44	bab5bcdc-e5dd-11e5-8482-ac72891c3257	921b8b8f6620826567d9324314c70410	f7dcac96-562c-11e6-a2a4-ac72891c3257	Temporal mean, Global field (single level) [XY-na] [am-tm]	65.0 r	390.0 r	220.0 r	270.0 r	AerChemMIP,C4MIP,CDRMIP,CFMIP,CMIP,DAMIP,DCPP,FAFMIP,GMMIP,GeoMIP,HighResMIP,ISMIP6,LS3MIP,LUMIP,PAMIP,PMIP,RFMIP,VIACSAB,VolMIP	CMIP	All			
Amon	1	TOA Outgoing Clear-Sky Shortwave Radiation	W m-2	Calculated in the absence of clouds.		rsutcs	toa_outgoing_shortwave_flux_assuming_clear_sky	area: time: mean	up	real	longitude latitude time	rsutcs	atmos	mon	area: areacella	Amon ((isd.003))	Amon_2d	45	bab69c06-e5dd-11e5-8482-ac72891c3257	12e0369ff0ba1a6f1a84e0d9565d4b07	f7dcac96-562c-11e6-a2a4-ac72891c3257	Temporal mean, Global field (single level) [XY-na] [am-tm]	-0.1 r	480.0 r	30.0 r	120.0 r	AerChemMIP,C4MIP,CDRMIP,CFMIP,CMIP,DAMIP,DCPP,FAFMIP,GMMIP,GeoMIP,HighResMIP,ISMIP6,LS3MIP,LUMIP,PAMIP,PMIP,RFMIP,VIACSAB,VolMIP	CMIP	All			
Amon	1	Water Vapor Path	kg m-2	vertically integrated through the atmospheric column		prw	atmosphere_mass_content_of_water_vapor	area: time: mean		real	longitude latitude time	prw	atmos	mon	area: areacella	Amon ((isd.003))	Amon_2d	46	bab45df6-e5dd-11e5-8482-ac72891c3257	fc637f1c75e58be8a6e4112411a00f36	f7dcac96-562c-11e6-a2a4-ac72891c3257	Temporal mean, Global field (single level) [XY-na] [am-tm]	0.0 r	90.0 r	12.0 r	26.0 r	AerChemMIP,C4MIP,CFMIP,CMIP,DAMIP,FAFMIP,GMMIP,GeoMIP,HighResMIP,ISMIP6,LS3MIP,LUMIP,PMIP,RFMIP,VIACSAB,VolMIP	CMIP	All			
Amon	1	Total Cloud Cover Percentage	%	Total cloud area fraction (reported as a percentage) for the whole atmospheric column, as seen from the surface or the top of the atmosphere. Includes both large-scale and convective cloud.	for the whole atmospheric column, as seen from the surface or the top of the atmosphere. Include both large-scale and convective cloud.	clt	cloud_area_fraction	area: time: mean		real	longitude latitude time	clt	atmos	mon	area: areacella	Amon ((isd.003))	Amon_2d	47	baaad7e0-e5dd-11e5-8482-ac72891c3257	7c2249d424dde72f8616d42870a9d425	f7dcac96-562c-11e6-a2a4-ac72891c3257	Temporal mean, Global field (single level) [XY-na] [am-tm]	-0.001 r	100.001 r	10.0 r	90.0 r	AerChemMIP,C4MIP,CFMIP,CMIP,DAMIP,DCPP,FAFMIP,GMMIP,GeoMIP,HighResMIP,ISMIP6,LS3MIP,LUMIP,PAMIP,PMIP,RFMIP,VIACSAB,VolMIP	CMIP	All			
Amon	1	Condensed Water Path	kg m-2	Mass of condensed (liquid + ice) water in the column divided by the area of the column (not just the area of the cloudy portion of the column). Includes precipitating hydrometeors ONLY if the precipitating hydrometeors affect the calculation of radiative transfer in model.	mass of condensed (liquid + ice) water in the column divided by the area of the column (not just the area of the cloudy portion of the column). Includes precipitating hydrometeors ONLY if the precipitating hydrometeor affects the calculation of radiative transfer in model.	clwvi	atmosphere_mass_content_of_cloud_condensed_water	area: time: mean		real	longitude latitude time	clwvi	atmos	mon	area: areacella	Amon ((isd.003))	Amon_2d	48	baab1818-e5dd-11e5-8482-ac72891c3257	80a1dd605b563e9f09c718a5ba9cb9cc	f7dcac96-562c-11e6-a2a4-ac72891c3257	Temporal mean, Global field (single level) [XY-na] [am-tm]	-3.827e-06 s	3.364 s		0.2846 s	AerChemMIP,C4MIP,CFMIP,CMIP,DAMIP,FAFMIP,GMMIP,GeoMIP,HighResMIP,ISMIP6,LS3MIP,LUMIP,PMIP,RFMIP,VolMIP	CMIP	All			
Amon	1	Ice Water Path	kg m-2	mass of ice water in the column divided by the area of the column (not just the area of the cloudy portion of the column). Includes precipitating frozen hydrometeors ONLY if the precipitating hydrometeor affects the calculation of radiative transfer in model.		clivi	atmosphere_mass_content_of_cloud_ice	area: time: mean		real	longitude latitude time	clivi	atmos	mon	area: areacella	Amon ((isd.003))	Amon_2d	49	baaa9852-e5dd-11e5-8482-ac72891c3257	73c496f5669cc122cf1cddfe4df2a27a	f7dcac96-562c-11e6-a2a4-ac72891c3257	Temporal mean, Global field (single level) [XY-na] [am-tm]	-1.872e-06 s	1.535 s		0.1187 s	AerChemMIP,C4MIP,CFMIP,CMIP,DAMIP,FAFMIP,GMMIP,GeoMIP,HighResMIP,ISMIP6,LS3MIP,LUMIP,PMIP,RFMIP,VolMIP	CMIP	All			
Amon	1	Net Downward Radiative Flux at Top of Model	W m-2	Net Downward Radiative Flux at Top of Model : I.e., at the top of that portion of the atmosphere where dynamics are explicitly treated by the model. This is reported only if it differs from the net downward radiative flux at the top of the atmosphere.	i.e., at the top of that portion of the atmosphere where dynamics are explicitly treated by the model. This is reported only if it differs from the net downward radiative flux at the top of the atmosphere.	rtmt	net_downward_radiative_flux_at_top_of_atmosphere_model	area: time: mean	down	real	longitude latitude time	rtmt	atmos	mon	area: areacella	Amon ((isd.003))	Amon_2d	50	bab6a91c-e5dd-11e5-8482-ac72891c3257	26328c46dfcc65d454b6fd4c52ccb48f	f7dcac96-562c-11e6-a2a4-ac72891c3257	Temporal mean, Global field (single level) [XY-na] [am-tm]	-250.0 r	250.0 r	40.0 r	150.0 r	AerChemMIP,C4MIP,CDRMIP,CFMIP,CMIP,DAMIP,FAFMIP,GMMIP,GeoMIP,HighResMIP,ISMIP6,LS3MIP,LUMIP,PMIP,RFMIP,VolMIP	CMIP	All			
Amon	1	Air Temperature	K	Air Temperature		ta	air_temperature	time: mean		real	longitude latitude plev19 time	ta	atmos	mon	area: areacella	Amon ((isd.003))	Amon_oth	62	bab8fa0a-e5dd-11e5-8482-ac72891c3257	b9c3eb96337c69c1c4a5aab1317f5563	f947ce0e-80ba-11e6-ab6e-5404a60d96b5	Temporal mean, Global field (19 pressure levels) [XY-P19] [tmean]	157.1 s	336.3 s	194.3 s	299.8 s	AerChemMIP,C4MIP,CFMIP,CMIP,DAMIP,DCPP,DynVarMIP,FAFMIP,GMMIP,GeoMIP,HighResMIP,LS3MIP,LUMIP,PAMIP,PMIP,RFMIP,VIACSAB,VolMIP	CMIP	All			
Amon	1	Eastward Wind	m s-1	Zonal wind (positive in a eastward direction).		ua	eastward_wind	time: mean		real	longitude latitude plev19 time	ua	atmos	mon	area: areacella	Amon ((isd.003))	Amon_oth	63	babb4b34-e5dd-11e5-8482-ac72891c3257	21db90c0a12448299f855fdab60930d4	f947ce0e-80ba-11e6-ab6e-5404a60d96b5	Temporal mean, Global field (19 pressure levels) [XY-P19] [tmean]	-68.65 s	136.6 s	1.101 s	22.42 s	AerChemMIP,C4MIP,CFMIP,CMIP,DAMIP,DCPP,DynVarMIP,FAFMIP,GMMIP,GeoMIP,HighResMIP,LS3MIP,LUMIP,PAMIP,PMIP,RFMIP,VIACSAB,VolMIP	CMIP	All			
Amon	1	Northward Wind	m s-1	Meridional wind (positive in a northward direction).		va	northward_wind	time: mean		real	longitude latitude plev19 time	va	atmos	mon	area: areacella	Amon ((isd.003))	Amon_oth	64	babbb25e-e5dd-11e5-8482-ac72891c3257	2dedcb347c18e132a2f4d625abf94585	f947ce0e-80ba-11e6-ab6e-5404a60d96b5	Temporal mean, Global field (19 pressure levels) [XY-P19] [tmean]	-71.1 s	69.93 s	0.9886 s	4.679 s	AerChemMIP,C4MIP,CFMIP,CMIP,DAMIP,DCPP,DynVarMIP,FAFMIP,GMMIP,GeoMIP,HighResMIP,LS3MIP,LUMIP,PAMIP,PMIP,RFMIP,VIACSAB,VolMIP	CMIP	All			
Amon	1	Specific Humidity	1	Specific humidity is the mass fraction of water vapor in (moist) air.		hus	specific_humidity	time: mean		real	longitude latitude plev19 time	hus	atmos	mon	area: areacella	Amon ((isd.003))	Amon_oth	65	bab00b98-e5dd-11e5-8482-ac72891c3257	53f4724d228998d54191c73352532ce3	f947ce0e-80ba-11e6-ab6e-5404a60d96b5	Temporal mean, Global field (19 pressure levels) [XY-P19] [tmean]	-0.000299 s	0.02841 s		0.01041 s	AerChemMIP,C4MIP,CDRMIP,CFMIP,CMIP,DAMIP,DCPP,DynVarMIP,FAFMIP,GMMIP,GeoMIP,HighResMIP,LS3MIP,LUMIP,PAMIP,PMIP,RFMIP,VIACSAB,VolMIP	CMIP	All			
Amon	1	Relative Humidity	%	The relative humidity with respect to liquid water for T> 0 C, and with respect to ice for T<0 C.	This is the relative humidity with respect to liquid water for T> 0 C, and with respect to ice for T<0 C.	hur	relative_humidity	time: mean		real	longitude latitude plev19 time	hur	atmos	mon	area: areacella	Amon ((isd.003))	Amon_oth	66	baafe578-e5dd-11e5-8482-ac72891c3257	3cc6766c2d001a58d18dfe7f60fd5e66	f947ce0e-80ba-11e6-ab6e-5404a60d96b5	Temporal mean, Global field (19 pressure levels) [XY-P19] [tmean]	-0.001 r	105.0 r	10.0 r	90.0 r	AerChemMIP,C4MIP,CDRMIP,CFMIP,CMIP,DAMIP,FAFMIP,GMMIP,GeoMIP,HighResMIP,LS3MIP,LUMIP,PMIP,RFMIP,VIACSAB,VolMIP	CMIP	All			
Amon	1	Omega (=dp/dt)	Pa s-1	Omega (vertical velocity in pressure coordinates, positive downwards)	commonly referred to as 'omega', this represents the vertical component of velocity in pressure coordinates (positive down)	wap	lagrangian_tendency_of_air_pressure	time: mean		real	longitude latitude plev19 time	wap	atmos	mon	area: areacella	Amon ((isd.003))	Amon_oth	67	babd0906-e5dd-11e5-8482-ac72891c3257	51fb29dd55442361fa9c5dbe23aca9c6	f947ce0e-80ba-11e6-ab6e-5404a60d96b5	Temporal mean, Global field (19 pressure levels) [XY-P19] [tmean]	-1.126 s	2.319 s		0.04256 s	AerChemMIP,C4MIP,CFMIP,CMIP,DAMIP,DCPP,DynVarMIP,FAFMIP,GMMIP,GeoMIP,HighResMIP,LS3MIP,LUMIP,PAMIP,PMIP,RFMIP,VIACSAB,VolMIP	CMIP	All			
Amon	1	Geopotential Height	m	Geopotential is the sum of the specific gravitational potential energy relative to the geoid and the specific centripetal potential energy. Geopotential height is the geopotential divided by the standard acceleration due to gravity. It is numerically similar to the altitude (or geometric height) and not to the quantity with standard name height, which is relative to the surface.		zg	geopotential_height	time: mean		real	longitude latitude plev19 time	zg	atmos	mon	area: areacella	Amon ((isd.003))	Amon_oth	68	babd9ace-e5dd-11e5-8482-ac72891c3257	28e774ec0ecd561a6a3d437e6c443a6b	f947ce0e-80ba-11e6-ab6e-5404a60d96b5	Temporal mean, Global field (19 pressure levels) [XY-P19] [tmean]	-719.7 s	34370.0 s		32990.0 s	AerChemMIP,C4MIP,CFMIP,CMIP,DAMIP,DCPP,DynVarMIP,FAFMIP,GMMIP,GeoMIP,HighResMIP,LS3MIP,LUMIP,PAMIP,PMIP,RFMIP,VIACSAB,VolMIP	CMIP	All			
Amon	1	Mole Fraction of O3	mol mol-1	Mole fraction is used in the construction mole_fraction_of_X_in_Y, where X is a material constituent of Y.		o3	mole_fraction_of_ozone_in_air	time: mean		real	longitude latitude plev19 time	o3	atmos atmosChem	mon	area: areacella	Amon ((isd.003))	Amon_oth	69	59fbf2a8-c77d-11e6-8a33-5404a60d96b5	1d4594c97188efd47935238a429e02e4	f947ce0e-80ba-11e6-ab6e-5404a60d96b5	Temporal mean, Global field (19 pressure levels) [XY-P19] [tmean]					AerChemMIP,C4MIP,CFMIP,CMIP,DAMIP,FAFMIP,GMMIP,GeoMIP,HighResMIP,LS3MIP,LUMIP,RFMIP,VolMIP	CMIP	All			
Amon	1	Mole Fraction of CO2	mol mol-1	Mole fraction is used in the construction mole_fraction_of_X_in_Y, where X is a material constituent of Y.		co2	mole_fraction_of_carbon_dioxide_in_air	time: mean		real	longitude latitude plev19 time	co2	atmos	mon	area: areacella	Amon ((isd.003))	Amon_oth	71	baab23da-e5dd-11e5-8482-ac72891c3257	9bb9a503065dfbd30c9bbe5c3c6abf99	f947ce0e-80ba-11e6-ab6e-5404a60d96b5	Temporal mean, Global field (19 pressure levels) [XY-P19] [tmean]					AerChemMIP,C4MIP,CFMIP,CMIP,DAMIP,FAFMIP,GMMIP,GeoMIP,HighResMIP,LS3MIP,LUMIP,PMIP,RFMIP,VolMIP	CMIP	All			
Amon	1	Mole Fraction of CH4	mol mol-1	Mole fraction is used in the construction mole_fraction_of_X_in_Y, where X is a material constituent of Y.		ch4	mole_fraction_of_methane_in_air	time: mean		real	longitude latitude plev19 time	ch4	atmos atmosChem	mon	area: areacella	Amon ((isd.003))	Amon_oth	75	baa9d642-e5dd-11e5-8482-ac72891c3257	7f4c49e8abe3230e87fa7299b73448fa	f947ce0e-80ba-11e6-ab6e-5404a60d96b5	Temporal mean, Global field (19 pressure levels) [XY-P19] [tmean]					AerChemMIP,C4MIP,CFMIP,CMIP,DAMIP,FAFMIP,GMMIP,GeoMIP,HighResMIP,LS3MIP,LUMIP,PMIP,RFMIP,VolMIP	CMIP	All			
